id,created_at,text,retweet_count,favorite_count,media_count,url_count
1099080389241516032,2019-02-22 22:55:59,"Pittsburg Chamber of Commerce were great hosts yesterday! Thanks my friends. 

@PittAreaChamber

https://t.co/C45IggBZji",1,2,0,1
1098764958429515777,2019-02-22 02:02:34,Have to stop by Chicken Mary’s on the way out of Pittsburg! https://t.co/C8J3aCEr8Q,3,19,1,0
1098642312337522691,2019-02-21 17:55:13,In Pittsburg touring Eagle Beverage today. These folks are doing a lot for the local economy and I look forward to… https://t.co/DXmdsKQGEc,1,9,0,1
1097288531117043713,2019-02-18 00:15:47,"Thank you and congrats Skyler on the homecoming, and to you Cydney, on the birth of your twins! 

https://t.co/Edqrp7E0Tj",1,7,0,1
1096237255335837697,2019-02-15 02:38:23,Kansans did not send me to Congress to continue to kick the can down the road. I am not interested in talking-point… https://t.co/0Jl5AxQZXK,13,49,0,1
1096123891024646145,2019-02-14 19:07:55,"RT @RepDavidTrone: It’s time to take action.

That’s why today I'm announcing the formation of the Freshmen Working Group on Addiction. 36…",38,0,0,0
1096063599221633025,2019-02-14 15:08:20,"The Maduro Regime has ties to the drug cartels, and now International terrorists organizations like Hezbollah &amp; FAR… https://t.co/XipOFKiofm",5,14,0,1
1095778684156432385,2019-02-13 20:16:11,"My 2-cents on the complex, important, and turbulent conflict in Yemen and related legislation. 

https://t.co/SIq9iiG0il",1,3,0,1
1095768342185562112,2019-02-13 19:35:05,We are debating U.S. military assistance in the Yemen conflict on the House Floor right now. Tune in to… https://t.co/cII6CM0DRy,4,5,0,1
1095754441444261888,2019-02-13 18:39:51,"President of Colombia, Iván Duque discussing the importance of our strategic partnership and the ongoing situation… https://t.co/xQmGrcicFX",2,6,0,1
1095749130197045248,2019-02-13 18:18:45,"“Dear God, help me be as good of a person as my dog thinks I am” - unknown 

Great to meet you Chief! Thanks for yo… https://t.co/lDdUOZIRYI",10,44,0,1
1095699156478423040,2019-02-13 15:00:10,UPDATE: My first piece of legislation is one step closer to becoming law.  It protects the National Historic Site a… https://t.co/KjfkwmApdj,1,11,0,1
1095420512573030400,2019-02-12 20:32:56,Today I met with the Kansas Medical Society to discuss rural healthcare issues facing Kansans. We talked about the… https://t.co/FGXRVdp69R,1,16,0,1
1095412803115143168,2019-02-12 20:02:18,"Though outside my district, these growing Kansas communities clearly provide critical economic opportunities throug… https://t.co/bHN03kBAAb",0,5,0,1
1095412802527875073,2019-02-12 20:02:18,"Many thanks to the dedicated Southwest Kansas community leaders from Dodge City, Garden City, and Liberal who stopp… https://t.co/btd3LLC4ZI",0,5,0,1
1095410927657238529,2019-02-12 19:54:51,Thanks to the Kansas RESULTS advocates who stopped by my office today. Always a pleasure seeing Kansans in DC! https://t.co/4Ic7AJpIbA,1,8,1,0
1095378927911165952,2019-02-12 17:47:42,You can sign up here 👇 https://t.co/zVkDISIrhp,1,2,0,1
1095371368294682626,2019-02-12 17:17:39,"Below is my first official newsletter! Make sure to sign up and pass along to your friends and family as well! 

https://t.co/DhqtX507gR",2,9,0,1
1094632592966647808,2019-02-10 16:22:02,"It was an honor speaking at the Leavenworth County Republican Party Lincoln Day Dinner last night! 

Always great s… https://t.co/SAfVLsdsnJ",2,6,0,1
1094607948544950273,2019-02-10 14:44:06,"The Fieldhouse was absolutely electric yesterday. Great view, great game, and great company with @KUnews Chancellor… https://t.co/PZTBzolsti",0,16,0,1
1094283995452456960,2019-02-09 17:16:49,"This week I introduced H.R. 1061, which will modify and enhance the boundary and mission of the Fort Scott National… https://t.co/obxakKV6rS",3,17,0,1
1093973539391225856,2019-02-08 20:43:11,Amen! https://t.co/EJ7y30LElD,3,8,0,1
1093964595042107393,2019-02-08 20:07:38,"Enjoyed getting to chat with Ranking Member Rep. @virginiafoxx today. Thanks for swinging by my office! 

For those… https://t.co/YZlIomP9k8",2,14,0,1
1093630056281325568,2019-02-07 21:58:18,"It was an honor to meet with M.K. Nava Boker, the Deputy Speaker of Knesset. Now more than ever it is essential for… https://t.co/5TwgE74kwx",4,10,0,1
1093621803182944257,2019-02-07 21:25:31,"Today, I introduced my first piece of legislation with the support of the entire Kansas House delegation. H.R. 1061… https://t.co/RXlMnMiPj3",2,13,0,1
1093602988147597312,2019-02-07 20:10:45,Enjoyed getting to chat with Sarah Irsik-Good with the Kansas Foundation for Medical Care today. Thanks for coming… https://t.co/knj8rLsZnu,1,2,0,1
1093550041967587329,2019-02-07 16:40:21,"RT @EdLaborGOP: Republican Leader @virginiafoxx talks with tipped workers who would lose their jobs in a $15 fed min wage hike. Oddly, they…",272,0,0,0
1093533655140651013,2019-02-07 15:35:14,Big thanks to the National Rural Health Association and the @kansashospitals Association for coming by my office to… https://t.co/VbVoB6PgbK,1,7,0,1
1093524965884862466,2019-02-07 15:00:43,Each morning @RepMullin gathers this group of bipartisan legislators and leads one of the toughest workouts around.… https://t.co/XEidoC9lNz,1,8,0,1
1093269148019425281,2019-02-06 22:04:11,"On this day in 1911, an American hero was born. When President Reagan spoke of a shining city on a hill, I felt lik… https://t.co/jA6FvOINKW",5,19,0,1
1093195922627022849,2019-02-06 17:13:13,“The Republicans have come forward to negotiate in full faith and transparency and I’d like to see the same from th… https://t.co/Nf03bKPKw8,5,13,0,1
1093155424642187264,2019-02-06 14:32:17,Getting briefed by my staff at the beginning of a busy day of Congressional Committee work! https://t.co/pRHjpArJSZ,4,18,1,0
1092991002741215237,2019-02-06 03:38:56,"We must come together - both as a nation, and as a body. Tonight, the President outlined a path forward, not for a… https://t.co/SWDqEB10LN",7,20,0,1
1092926712478920704,2019-02-05 23:23:28,"Instead of watching the Jayhawks beat the Wildcats tonight, @KUProvostCarl and I will be watching @POTUS deliver th… https://t.co/3RtUfnQfxp",6,20,0,1
1092895740689608707,2019-02-05 21:20:24,It was great getting to sit down with student leaders and staff from Haskell University today. I look forward to wo… https://t.co/okrgIsrbac,1,8,0,1
1092852989461757952,2019-02-05 18:30:31,Thank you to Bill and Allan from the Kansas Rural Water Association for updating me on their improvements to our st… https://t.co/UFwwXc1k2m,1,5,0,1
1092824422656937984,2019-02-05 16:37:00,Appreciate Sunee Mickle from BlueCross BlueShield of Kansas for coming by my office today! https://t.co/DqNqXgmnU0,0,8,1,0
1092811708077408258,2019-02-05 15:46:29,Enjoyed meeting with Topeka Mayor Michelle De La Isla yesterday. I look forward to working together for the betterm… https://t.co/TEyZYAds6F,1,8,0,1
1092805405301006343,2019-02-05 15:21:26,The pleasure was all mine! Make sure to stay in touch and keep up the great work! https://t.co/Kp5WpYGl2W,3,12,0,1
1092784758231306240,2019-02-05 13:59:23,RT @WeAreHolton: Samantha is a Senior at Holton High School.  Congratulations on leading the way.  #WeAreHolton https://t.co/SSCotPPPcl,5,0,0,1
1092536436870529026,2019-02-04 21:32:39,"With next week being Future Business Leaders of America week, I decided to jump the gun and meet with some of the K… https://t.co/ngu25aCtL9",7,18,0,1
1092451023564754951,2019-02-04 15:53:15,"It is time to be calculated, precise, and absolutely merciless when combatting international terrorism.

https://t.co/r1sqYqS5dA",3,7,0,1
1092451022772023297,2019-02-04 15:53:15,Combatting international terrorism is an ever-evolving dynamic that requires first-hand experience in tactical warf… https://t.co/VRjPlWoPXI,3,12,0,1
1092078204792262657,2019-02-03 15:11:48,"A great event with an even greater cause. All proceeds go to the Kansas Special Olympics and keeping the over 4,000… https://t.co/v44uSpgXe6",3,13,0,1
1092078192653791232,2019-02-03 15:11:45,"Yesterday I participated in the 15th Annual Topeka #PolarPlunge put on by the @Topeka_Police, @ShawneeSheriff’s Off… https://t.co/9HfRraZpgX",2,10,0,1
1091852116052848646,2019-02-03 00:13:24,Congrats #MVPat. Big things on the horizon KC! #chiefskingdom @PatrickMahomes5,1,15,0,0
1091734444686405637,2019-02-02 16:25:49,Yesterday I toured the VA Eastern KS Healthcare System facilities in Topeka. They are doing some amazing work with… https://t.co/AThAMgl6iq,3,16,0,1
1091039402845982725,2019-01-31 18:23:58,"Education is the primary avenue for Kansans to achieve the American dream. 

https://t.co/6N1hgvIU4K",0,6,0,1
1091007485958414336,2019-01-31 16:17:09,"Still get chills. Two American heroes. 

https://t.co/7a2c9ABdbj",1,7,0,1
1090983577737666560,2019-01-31 14:42:09,Absolutely disgusting. This is why the pro-life movement matters and is as important as ever. https://t.co/dyzd5p28w7,4,15,0,1
1090724752233320449,2019-01-30 21:33:40,Great chatting with the county and district attorneys of Kansas today. Thanks for coming by! https://t.co/mzsb03xAPV,1,6,1,0
1090707662260617227,2019-01-30 20:25:45,"Topeka native, KU alum, and Folds of Honor champion, Gary Woodland. Awesome stuff! https://t.co/W8Hs8AfMK7",4,12,0,1
1090334537920495616,2019-01-29 19:43:05,Had my first House Ed &amp; Labor and Foreign Affairs Committee meetings today. Looking forward to getting to work! https://t.co/FH5iLZr3Ox,4,12,1,0
1090318688304156672,2019-01-29 18:40:07,Always enjoy getting to chat with the @KS_Bankers Association. Thanks for coming by my office today! https://t.co/pKhRvFSTzD,3,13,1,0
1090303677196324871,2019-01-29 17:40:28,"Thanks to the local School Board members from Topeka, Basehor, and Lawrence for coming by to talk education policy… https://t.co/gP0rYT5X6W",1,8,0,1
1090285692217974789,2019-01-29 16:29:00,Great to have so many biofuel experts from the Fuels America Coalition in my office to chat about energy and agricu… https://t.co/fwd08evl80,0,10,0,1
1090257078453719040,2019-01-29 14:35:18,"Yesterday I spoke on the House Floor honoring Kansas and Kansas Day.

Check it out below! 

https://t.co/jqizPcM7HL",1,15,0,1
1089901150877429760,2019-01-28 15:00:58,"I was honored to be invited to speak at the Bleeding Kansas event in Lecompton yesterday. 

Great program and great… https://t.co/oGgb0T3Ukf",1,11,0,1
1089634607065153536,2019-01-27 21:21:49,I’ve been to the death camps in Auschwitz &amp; Yad Vashem in Israel. These powerful and tragic sites remind us of our… https://t.co/BSWa8c5wmj,1,15,0,1
1089634606217904128,2019-01-27 21:21:49,On this Holocaust Remembrance Day we honor the millions of lives lost and the heroes who helped put an end to the evil.,2,11,0,0
1089613831268118528,2019-01-27 19:59:16,I had a great time speaking at the Kansas Day Club dinner last night. 158 years looks good on you Kansas! https://t.co/9QQLG1OaRk,0,9,1,0
1089559754710622208,2019-01-27 16:24:23,Had a great time at the Topeka West JROTC 17th Annual Chili Feed yesterday! Good chili and even better company. Tha… https://t.co/LHiDDkEsXv,0,9,0,1
1089211857360117760,2019-01-26 17:21:58,Always enjoy getting to chat with the @ShawneeCoGOP. Keep up the great work! https://t.co/ktZLpNsc6B,1,7,1,0
1088916001364815873,2019-01-25 21:46:20,"Such an honor talking again with @SenPatRoberts. An outstanding mentor. Full of wisdom, advice, and jabs at my Army… https://t.co/B0UwgIkg39",1,23,0,1
1088901038533414912,2019-01-25 20:46:53,"Another good faith offer from the President. The American people have suffered enough. We have three weeks, put the… https://t.co/INUJNcZss3",4,19,0,1
1088823061200154625,2019-01-25 15:37:01,The US is the global leader and how we are situated in the global landscape is critically important not just for ou… https://t.co/xtL5KFdAFN,3,13,0,1
1088816032943407104,2019-01-25 15:09:06,Was troubled by the disappearance of 14-year-old Chloe. Great work by Topeka’s finest in finding her.… https://t.co/yU8L2YWOEw,1,10,0,1
1087488669278265344,2019-01-21 23:14:37,#MLKDAY https://t.co/xZVMefH0dw,1,12,1,0
1086777905307369472,2019-01-20 00:10:18,"As I stated to @41actionnews yesterday, the Democrats need to come to the table for good faith negotiations. What… https://t.co/P7Gt26Y3Tv",5,16,0,1
1086311268938665986,2019-01-18 17:16:03,"Today is an important time for us all to be a voice for the voiceless. 

#life #prolife https://t.co/p4EUaZXO70",4,21,1,0
1085978149052125184,2019-01-17 19:12:21,Although they were all barely able to fit in my office - it was great getting to talk with the Kansas Chiropractic… https://t.co/pKTmN4t57P,4,20,0,1
1085932157846110208,2019-01-17 16:09:36,Great getting to chat with the Kansas Hospital Association today. We talked about rural healthcare and what can be… https://t.co/YmDUIiXGar,2,11,0,1
1085673850577268736,2019-01-16 23:03:11,Great to have John Rathbun and the Cutler Repaving folks stop by my office today to discuss pavement preservation.… https://t.co/S4kZIg2kIo,1,9,0,1
1085594182524329984,2019-01-16 17:46:37,Today I had the pleasure of meeting with Mike Oxford and Ami Weidler-Hyten with the Topeka Independent Living Resou… https://t.co/HZ4R6U0mRb,0,8,0,1
1085293005475590144,2019-01-15 21:49:50,The Military Birth Resource Network is doing great work providing a network of support for military families. Thank… https://t.co/vZC73GckMm,0,10,0,1
1085272949677047809,2019-01-15 20:30:09,"It is time for our politics to represent the best of us, not appeal to the worst of us. For these reasons and many… https://t.co/C3ji4urHoc",2,10,0,1
1085272949106638853,2019-01-15 20:30:09,Members of this body should be held to a higher standard. If we – as members of this great institution – cannot hol… https://t.co/8Yy8xzT7Ms,2,16,0,1
1085272948410380288,2019-01-15 20:30:08,"Today, the House voted on H.Res. 41, a resolution rejecting white nationalism and white supremacy. This type of rhe… https://t.co/bZA524aCvQ",4,20,0,1
1085207014228267013,2019-01-15 16:08:09,Always a pleasure getting to sit down with @JackRCline! I look forward to working together on behalf of @KUnews. Ro… https://t.co/jmsCeEM2sJ,2,13,0,1
1084142086851624962,2019-01-12 17:36:30,"My staff and I are fully devoted to delivering world-class constituent services. 

This seat belongs to the people… https://t.co/F86Mweo4RM",0,15,0,1
1084141126825791488,2019-01-12 17:32:41,"I have recently accepted the invitation to join the Problem Solvers Caucus, where I look forward to working on comm… https://t.co/FlJe2WqKhj",0,13,0,1
1084140741209874433,2019-01-12 17:31:09,My very first vote was against Nancy Pelosi to serve as Speaker of the House. I co-sponsored the no work no pay act… https://t.co/RR5m9935x1,1,15,0,1
1084139304669118465,2019-01-12 17:25:27,It’s always a pleasure getting to address the second district gop. I can’t thank all of these people enough for the… https://t.co/JRS8oTBmD6,1,16,0,1
1084133315815325696,2019-01-12 17:01:39,Here at the State Capitol for the @KansasGOP second district re-org. Always a pleasure seeing National Committee Wo… https://t.co/tj2jy3z0Rb,0,9,0,1
1083829500247490560,2019-01-11 20:54:24,Today is human trafficking awareness day – a day we should all ask ourselves if there is more we can do to combat t… https://t.co/r07Flt1j8J,2,11,0,1
1083774878921166849,2019-01-11 17:17:21,4/4 We must continue to advance U.S. policy that eliminates anti-Semitism throughout all corners of the globe.,2,8,0,0
1083774878325587968,2019-01-11 17:17:21,3/4 The appointed Envoy must also have extensive distinction in the field of religious freedom or combating anti-Se… https://t.co/t09ZzPizV8,2,9,0,1
1083774877075759104,2019-01-11 17:17:20,2/4 This timely legislation enhances the role of Special Envoy to Monitor and Combat Anti-Semitism. It elevates the… https://t.co/5ihHz0UkwJ,1,8,0,1
1083774876547235840,2019-01-11 17:17:20,"1/4 Anti-Semitism and like-minded hatred do not belong in our society, nor does it belong anywhere around the world… https://t.co/ZiIeITPqID",6,14,0,1
1083489818082983936,2019-01-10 22:24:37,It was great sitting down with you @RepDavids I look forward to finding ways we can work together for Kansas. https://t.co/sZ64zKTuCY,13,62,0,1
1083447884438228996,2019-01-10 19:37:59,Wonderful news for Kansas today with the KC-46A Tanker ”Pegasus” coming to Mcconnel Air Force Base! Great work by b… https://t.co/1ou3fPxYMi,0,8,0,1
1083384516377497600,2019-01-10 15:26:11,Kansans sent me to Washington to deliver results. I look forward to working with members of both parties in the Pro… https://t.co/aH2RmwJ8vc,3,12,0,1
1083124788216893440,2019-01-09 22:14:07,I know what it is like going to work each day knowing it could be the last. Make sure to thank a law enforcement of… https://t.co/RUNA6HQFDC,1,12,0,1
1082775781720371201,2019-01-08 23:07:18,"Today I had the honor of leading House proceedings in the Pledge of Allegiance 

Check it out here 👉 https://t.co/hJlTn9KwRa",2,8,0,1
1082736967484354561,2019-01-08 20:33:03,Today I delivered my maiden speech on the House floor reaffirming my commitment to Kansas - you can check it out he… https://t.co/58vMs1jwXu,5,16,0,1
1081301283628351492,2019-01-04 21:28:10,He has dedicated his life to his state and to his country. It has been an honor to have such a man heading the dele… https://t.co/xlsLDWxAo4,3,18,0,1
1081301283104014337,2019-01-04 21:28:10,"Senator, Representative, Kansan, Father, Husband, Marine, and above all – patriot. @PatRoberts is the standard bear… https://t.co/LAWwoFwj8U",6,30,0,1
1081294894193430529,2019-01-04 21:02:46,If you don't get paid - I dont https://t.co/79ZUFvWkDb,32,172,1,0
