id,created_at,text,retweet_count,favorite_count,media_count,url_count
1098718960319639554,2019-02-21 22:59:48,I like his parents values and have to say this is a cause I can get behind! This young man understands the need to… https://t.co/UlpflCcalv,1,2,0,1
1097982947037274112,2019-02-19 22:15:08,"Last week I joined 14 other Texas Members in voting ""no"" on this latest spending bill. This spending bill does not… https://t.co/vhCHlxmeky",2,18,0,1
1097980213412143105,2019-02-19 22:04:17,@tarrantgop thank you for hosting a wonderful event Saturday evening. The Lincoln Day Dinner was a great success. W… https://t.co/trswtidiTp,0,0,0,1
1096415872908955648,2019-02-15 14:28:09,A fav little town in my district is up for an award and we need your help. It is the only #Texas town in the top fi… https://t.co/6in1fIc2RJ,3,5,0,1
1095453484282007552,2019-02-12 22:43:57,The conference committee should have properly funded the wall and our #bordersecurity cause if not the president wi… https://t.co/uK05y4OdSJ,1,9,0,1
1095369971780276224,2019-02-12 17:12:06,"UTA is providing exactly what we need from our institutions of public higher education, by enrolling and graduating… https://t.co/1FNYYlq7tf",1,6,0,1
1095093482090315781,2019-02-11 22:53:26,Joined my colleagues today in co-sponsoring this legislation. We must always honor the heroes who have sacrificed s… https://t.co/Hr5FrbVhBt,0,5,0,1
1095090248084848641,2019-02-11 22:40:35,Today my office sent a letter to @SecPompeo urging him to do everything in his power to bring Majd Kamalmaz home fr… https://t.co/icNE6ZMvEF,15,30,0,1
1095040226534273025,2019-02-11 19:21:49,Comments like those of my colleague Ilhan Omar are not just insensitive they are Anti-Semitic and bigoted! She shou… https://t.co/y0jf7IZ2QX,25,113,0,1
1095038753851277312,2019-02-11 19:15:58,Strong support last night for the work being done by @AIPAC We must always stand with Israel and do everything we c… https://t.co/rkS7MO31V2,21,79,0,1
1093969839033597955,2019-02-08 20:28:29,"RT @FindFarmCredit: Our board chairman, Jimmy Dodson, left, met with Rep. Michael Cloud and his wife, Rosel, at Texas Agriculture's Welcome…",7,0,0,0
1093887866780958725,2019-02-08 15:02:45,Come by our office any time. We look forward to seeing you! https://t.co/8RxL22VIz2,2,8,0,1
1093639985075499008,2019-02-07 22:37:45,@MQSullivan @VanTaylorTX @Lancegooden @WillHurd @TXRandy14 @DanCrenshawTX @RepArrington @RepBrianBabin… https://t.co/P72bGB0AKS,2,7,0,1
1093626774158757888,2019-02-07 21:45:16,My heart is heavy to learn of the passing of Arlington Police Chaplin Harold Elliot. He was a good man and a friend… https://t.co/OeZT4jyOCz,0,4,0,1
1093620620670189568,2019-02-07 21:20:49,@kketb Wearing my pin today in to highlight the #Enditmovement https://t.co/TJOWy8QZXR,3,10,1,0
1093616251375624192,2019-02-07 21:03:27,Attending a round table with the Estonian Ambassador discussing Russian aggression and ways to combat it.… https://t.co/9zkG8CMikd,0,6,0,1
1093593723211001856,2019-02-07 19:33:56,@momisaverb So important that we as members of Congress keep our priorities straight! I am saddened as well to see… https://t.co/jpJHwFAJ2W,0,0,0,1
1093589861519581190,2019-02-07 19:18:35,"Sitting with representatives from Pakistan, Uganda, Namibia, and Greece at the National #PrayerBreakfast this morni… https://t.co/f8PrtPRCgq",0,5,0,1
1093589276133076992,2019-02-07 19:16:15,"If My people who are called by My name will humble themselves, and pray and seek My face, and turn from their wicke… https://t.co/akyEgFG8VP",1,15,0,1
1093551076891086848,2019-02-07 16:44:28,"RT @EdLaborGOP: Republican Leader @virginiafoxx talks with tipped workers who would lose their jobs in a $15 fed min wage hike. Oddly, they…",272,0,0,0
1093542559278866432,2019-02-07 16:10:37,Enjoyed hosting you in my office. I am looking forward to working with our good friends to the north. https://t.co/RT6CITN2MY,1,5,0,1
1093528380673269760,2019-02-07 15:14:17,When a servant falls we should remember and honor them. Godspeed Agent Doss. #BorderPatrol https://t.co/JBaOVrpoaH,1,6,0,1
1093270100524888064,2019-02-06 22:07:58,@POTUS was very clear about his vision for America! #ChooseGreatness #SOTU2019,0,3,0,0
1093268266208903168,2019-02-06 22:00:41,"@POTUS was very clear with his vision for America’s future. 

On the issues that matter most, protecting freedom an… https://t.co/vo5LuQ9a1K",0,0,0,1
1093266739574521857,2019-02-06 21:54:37,I was heartened to hear @POTUS strong stance in favor of the unborn and innocent life. Promoting a culture that pro… https://t.co/VItbCCi5vC,56,176,0,1
1092866608085811201,2019-02-05 19:24:38,I am looking forward to attending President Trumps' second #SOTU Address. It will air at 9pm EST Make sure to tune… https://t.co/Wejtn0AO6c,1,7,0,1
1092544912988491776,2019-02-04 22:06:20,Medicare for all is Medicare for none! The socialist healthcare system that many Democrats are talking about would… https://t.co/vU848BosJ0,2,8,0,1
1092505500661571584,2019-02-04 19:29:43,My prayers and heartfelt thanks for her service. May she rest in peace. https://t.co/aYZ7GvTQlx,1,10,0,1
1092502846698856449,2019-02-04 19:19:11,Thank you for hosting us today. Great time spent with people who are working to strengthen business in all of Texas… https://t.co/5KFurjbWVr,0,6,0,1
1092451568706826240,2019-02-04 15:55:25,"RT @RepMarkWalker: .@RalphNortham, third trimester babies want to finish their term as well.",5639,0,0,0
1091381155427958785,2019-02-01 17:01:58,"304,000 Jobs added in January! More jobs, better wages for more workers and a number that far succeeds the experts… https://t.co/M6BTzOEVd0",2,15,0,1
1091360101896802305,2019-02-01 15:38:19,Thanks to the Chamber for having me. Great to see local friends. https://t.co/qsqvmuJ5EG,1,4,0,1
1091068734205243392,2019-01-31 20:20:31,@MKamalmaz @RepFrenchHill I will be working with my colleagues to help in any way I can to free your father. #FreeMajd,3,8,0,0
1091068152765734913,2019-01-31 20:18:13,Proud to join Friends of a Free and Democratic Syria Caucus. Also joining my colleague @RepFrenchHill and calling f… https://t.co/ByNpr3WPiu,22,37,0,1
1090984963267325953,2019-01-31 14:47:39,#SecureOurBorder https://t.co/U72s5I1JnU,1,4,0,1
1090719755697340444,2019-01-30 21:13:49,"Grateful to hear that the Committee on Natural Resources voted to keep ""so help you God"" in the witness oath.… https://t.co/ziqZicPAkr",0,5,0,1
1090627208752910342,2019-01-30 15:06:04,"The #Democrats sitting on the  House Committee on Natural Resources have decided to remove ""So help me God"" from th… https://t.co/DtZRhPsLiZ",8,24,0,1
1090621616437035008,2019-01-30 14:43:50,@ski4me1 @HouseForeignGOP Thank you! I will keep them awake.,0,1,0,0
1090353122483097601,2019-01-29 20:56:56,Work got underway at my first Foreign Affairs Committee meeting today. Let’s get to it. @HouseForeignGOP https://t.co/lUQFUp3XRR,8,53,1,0
1090296568639561728,2019-01-29 17:12:13,Preach! My space heater is turned to high in preparation. #PolarVortex2019 https://t.co/mkqtxI12Xa,0,2,0,1
1090272710792376326,2019-01-29 15:37:25,God bless #Texas https://t.co/jkRDXjgP9a,0,4,0,1
1090269189665841155,2019-01-29 15:23:25,This is very concerning and erodes confidence in our elections. I applaud the Secretary of State and Attorney Gener… https://t.co/0PHLDJFWn1,0,2,0,1
1089946873987825664,2019-01-28 18:02:39,This is a great story. Texans showed up today! #TexasVeterans https://t.co/5Qup8Y1pr2,0,8,0,1
1089903798267588608,2019-01-28 15:11:29,May we never forget. 74 years ago as of yesterday. #Auschwitz https://t.co/3m5DNseOtL,0,2,0,1
1089897878330449920,2019-01-28 14:47:58,If you live in Navarro County this is very important for you! Get connected to the emergency alert system. You can… https://t.co/IQib1zDK7S,1,3,0,1
1089187491956051973,2019-01-26 15:45:08,The smugness and condescension of Pelosi and Schumer was inappropriate ... Talk of who won or lost is premature bec… https://t.co/QmhYrMLNP0,7,17,0,1
1088838505701273602,2019-01-25 16:38:24,Democrat Leadership can’t stand the thought of allowing @POTUS to speak before the American people while the gov is… https://t.co/4HjNU40138,4,15,0,1
1088248823347138560,2019-01-24 01:35:12,Grateful to be serving with these members! https://t.co/RBEWwQslgj,2,14,0,1
1088164541169569792,2019-01-23 20:00:18,Thankfully Israel has an excellent missile defense program Iranian forces would have succeeded in killing many civi… https://t.co/rJ0YidcxTc,13,37,0,1
1087786308779626496,2019-01-22 18:57:20,This weekend @POTUS proved once again that he is ready to negotiate. Sadly the democrats showed they are more inter… https://t.co/vDNTiGICdI,3,20,0,1
1087091056129335297,2019-01-20 20:54:39,Grateful the Fifth Circuit Court of Appeals got it right! #sanctityoflifesunday #prolife #marchforlife https://t.co/oWBy1XHeUM,0,6,0,1
1086456639903989762,2019-01-19 02:53:42,RT @RepChipRoy: Congress should be in Washington to work on securing our border. I am here. Why is ⁦@SpeakerPelosi⁩ closing the People’s Ho…,164,0,0,0
1086416091004497921,2019-01-19 00:12:35,Thankful for the thousands who gathered to march for life today in DC and for all those who are fighting for the li… https://t.co/byndP4C3jp,3,21,0,1
1085997222381129728,2019-01-17 20:28:09,👀 Your move Madam Speaker #SecureOurBorder https://t.co/xPdaaK0Khu,3,19,0,1
1085982320727855105,2019-01-17 19:28:56,Thanks for the highlight! It was a good day. Aggie students past and present are always welcome in our office!… https://t.co/pcq0Gsvz5c,0,3,0,1
1085925920333070337,2019-01-17 15:44:49,No Texas Congressional office is complete without a big ol’ Texas Flag! #Texas https://t.co/sYpbfK9Xhp,3,19,1,0
1085914229368975361,2019-01-17 14:58:22,Yesterday I introduced my first Resolution before the House on #ReligiousFreedomDay HR 47 affirms that the United S… https://t.co/eYTCWKMPcL,1,2,0,1
1085532038587957248,2019-01-16 13:39:40,"Thanks @MarkDavis for having me on his show last week to talk about what it’s like to be a freshman congressman, li… https://t.co/ltKgPpvNDX",1,11,0,1
1085287905596194816,2019-01-15 21:29:35,Walls work! #SecureOurBorder https://t.co/ZXWz6waaTf,6,13,0,1
1085257534934605827,2019-01-15 19:28:54,Congratulations to our Texas @GovAbbott and Lt. Gov @DanPatrick on their inauguration today. God bless Texas. #TexasStrong,0,7,0,0
1085222970941992961,2019-01-15 17:11:33,@POTUS compromise has included things dems asked for but they still refuse to come to the table. With every refusal… https://t.co/sRQJVw7hcs,0,5,0,1
1084567418540883971,2019-01-13 21:46:37,The Democrats are nowhere to be found in Washington this weekend but I’m here in case they want to begin actual neg… https://t.co/X5HDOqGAoT,415,1310,0,1
1084132207692791813,2019-01-12 16:57:15,My thoughts and prayers are with the Arlington Police Department and especially the officer who was shot last night… https://t.co/eNmxpjkz5g,5,19,0,1
1083787732202254336,2019-01-11 18:08:25,"Yesterday standing next to a steel wall Jim Acosta made @POTUS point for him from McAllen, TX saying that the absen… https://t.co/AV5AYKYeqG",6,21,0,1
1083467947480363010,2019-01-10 20:57:43,"RT @cspan: President Trump, @JohnCornyn, @SenTedCruz receive #BorderSecurity briefing - LIVE on C-SPAN3 https://t.co/ZH7GxWenrm https://t.c…",126,0,0,1
1083464664867135490,2019-01-10 20:44:40,I fully support the president’s insistence on funding for border security. I understand the difficulty that Democra… https://t.co/EoNyDN5nEJ,5,9,0,1
1083029113026301952,2019-01-09 15:53:56,My heartfelt thanks to all law enforcement officers and Personel who protect and serve the people of the 6th Distri… https://t.co/NFC8Eid0gA,0,4,0,1
1083018612221333505,2019-01-09 15:12:13,@momisaverb Thank you!,0,0,0,0
1083011193101578240,2019-01-09 14:42:44,The safety and security of the American people should never be used as a bargaining chip. #SecureOurBorder,5,7,0,0
1083011045185257472,2019-01-09 14:42:09,"President Trump understands border security is essential to keeping Americans safe and preserving our sovereignty.
#SecureOurBorder",1,1,0,0
1081712817038872581,2019-01-06 00:43:27,"America should be a welcoming, hospitable refuge for people who are seeking to better their lives and raise their f… https://t.co/hvwRdtVbc5",2,4,0,1
1081711958615908360,2019-01-06 00:40:02,"At the White House Speaker Pelosi dismissed Sec. Nielsen’s presentation by saying, “I reject your facts.” Sorry Mad… https://t.co/NveAtaJFuo",2,10,0,1
1081705074349563910,2019-01-06 00:12:41,We could have continued the debate about responsibly for the partial shutdown. But by requiring a new precondition… https://t.co/5sIdFj5nSe,6,13,0,1
1081704863782879235,2019-01-06 00:11:51,Speaker Pelosi proclaiming the wall is immoral is reckless and theologically groundless. How grand it must be to pr… https://t.co/hMJAcvhTDM,0,3,0,1
1081692748976214016,2019-01-05 23:23:42,Last night I joined @trish_regan show on @FoxBusiness to talk about the government shutdown and the failure of the… https://t.co/Wa0ispWYUp,2,2,0,1
1081653223491059714,2019-01-05 20:46:39,Well said by my Texas colleague. Also why would Dems be so anxious to ignore the safety of American citizens in fav… https://t.co/3FzkjBVepE,0,7,0,1
1081344647291695105,2019-01-05 00:20:28,@unlobodelnorte Thank you!,0,1,0,0
1081312924315148289,2019-01-04 22:14:25,Later this evening I will be on Fox Business Network. Tune in at 8 pm. We will be discussing the government shutdow… https://t.co/YdEZ77s5Pz,0,3,0,1
