id,created_at,text,retweet_count,favorite_count,media_count,url_count,Classification,Sentiment
210462329907843072,2012-06-06 20:05:04,b'aww poor Jean #Eastenders',7,23,0,0,Anti-Green,-0.4767
210093272851427328,2012-06-05 19:38:34,"b'Watching #bigbrother , I am considering appearing on the next celebrity edition, as Sally did. What do you all think? #BBUK'",10,49,0,0,LibDem,0.0
209982584690720768,2012-06-05 12:18:44,"b""RT @Rectormart: John Bercow's prayer of grace before lunch at Westminster Hall. Truly SHOCKING!""",1,0,0,0,Conservative,0.0516
209979451646279681,2012-06-05 12:06:17,b'Finally. we can tuck in to some food. #jubilee',4,5,0,0,Non-Aligned,0.0
209979219223117825,2012-06-05 12:05:21,b'About to do a speech #jubilee',0,3,0,0,Conservative,0.0
209979017162539009,2012-06-05 12:04:33,"b'@Queen_UK I could order him to keep quiet, if you would like?'",3,4,0,0,Non-Aligned,0.3612
209978853370757121,2012-06-05 12:03:54,b'*Yawn* #jubilee',0,4,0,0,SNP,0.0
209975081076666370,2012-06-05 11:48:55,b'I do like a good #jubilee',1,5,0,0,Conservative,0.6597
