id,created_at,text,retweet_count,favorite_count,media_count,url_count
1103677937411190785,2019-03-07 15:25:00,"""The time to be a bystander is over.""

Hauke Grün, a new Liberal Democrat member, shares how Brexit stirred him to… https://t.co/AFxQjBgIcF",14,29,0,1
1103671356237987847,2019-03-07 14:58:51,"The Conservatives haven't done nearly enough to stop the rise of violent crime, putting communities at risk.
Libera… https://t.co/RML5LwpCbu",11,16,0,1
1103658560184045569,2019-03-07 14:08:00,"Ahead of International Women's Day, Liberal Democrat @Wera_Hobhouse MP is introducing a bill for greater mental hea… https://t.co/r1ZIR416TE",19,27,0,1
1103631896737656832,2019-03-07 12:22:03,The threat of short term prison sentences does not lead to a reduction in knife-carrying by young people -… https://t.co/gXZAKgBACx,49,79,0,1
1103616533039927297,2019-03-07 11:21:00,Want to get involved with the party leading the fight against Brexit? Come to Spring Conference - 15-17 March at Yo… https://t.co/UGX8e6WWqc,4,13,0,1
1103611751701057536,2019-03-07 11:02:00,"Join us and take a stand against Brexit on March 23rd.

https://t.co/LXOceaT1kl",10,26,0,1
1103601771677663233,2019-03-07 10:22:20,RT @WelshLibDems: On #UniMentalHealthDay we're delighted our Education Minister @Kirsty_Williams has announced £2million in new funding to…,30,0,0,0
1103595605593673728,2019-03-07 09:57:50,The Conservatives have made a mess of Brexit. It's time to put power back in the hands of the British people and gi… https://t.co/DpU5JONqQ0,29,49,0,1
1103376954030358528,2019-03-06 19:29:00,"People across the country are demanding better and joining our campaign for a People's Vote on the Brexit deal, wit… https://t.co/mQaUd0ozfh",29,45,0,1
1103348517207187465,2019-03-06 17:36:00,"After the British people bailed out the banks, these banks have closed branches across the country and failed to co… https://t.co/PtIYdHkUlM",75,175,0,1
1103323763549048833,2019-03-06 15:57:38,It's unacceptable that women and girls are still paying more for basic products like razors and deodorant.… https://t.co/2GOf5mlttJ,23,48,0,1
1103314547295711232,2019-03-06 15:21:01,Want to get involved with the party leading the fight against Brexit? Come to Spring Conference - 15-17 March at Yo… https://t.co/3Jo0GB5ydN,19,27,0,1
1103300953514672128,2019-03-06 14:27:00,We must take a new approach to tackle rising violent crime. Liberal Democrats are proposing a public health strateg… https://t.co/DOaqIjoSLo,86,103,0,1
1103272516024360961,2019-03-06 12:34:00,"""We must demand better than the occasional backbench debate on climate change. We need to turn up the volume and sh… https://t.co/5k9oit72oF",85,172,0,1
1103271213059723264,2019-03-06 12:28:49,RT @SkyNews: Theresa May dodges @timfarron 's question on UK banks https://t.co/ZuGC0KNBgj,63,0,1,0
1103234264206700544,2019-03-06 10:02:00,"""Brexit is now a head-counting exercise, with Theresa May attempting any and every ploy to get MPs behind the agree… https://t.co/Gcp9ZHsQP5",62,87,0,1
1103229418670080000,2019-03-06 09:42:45,"""Lib Dems believe that school children must be given the freedom to choose what they wear – not be confined by outd… https://t.co/48jcodFlKW",45,142,0,1
1103222039698128896,2019-03-06 09:13:25,"RT @joswinson: Don't be fooled by warm words from  the PM today - the Tories can't be trusted on workers' rights, and here's why 👇🏼 https:/…",255,0,0,0
1103216396064841731,2019-03-06 08:51:00,"Sick of Brexit? Join our march to stop Brexit on March 23rd in London.
Details here &gt; https://t.co/McmPbIJtq9 https://t.co/FOvslOReWL",14,43,1,1
1103019851201703936,2019-03-05 19:50:00,There is still time to stop Brexit - make your voice heard with us on March 23rd &gt; https://t.co/McmPbIJtq9 https://t.co/lgfGJylwKu,61,99,1,1
1102988646125395968,2019-03-05 17:46:00,How do we reduce knife crime? It's time for a public health approach. @JoSwinson shares how this approach led to dr… https://t.co/PaowgOl5aB,51,88,0,1
1102964989533478912,2019-03-05 16:12:00,"Join us and take a stand against Brexit on March 23rd.

https://t.co/LXOceaBpVL",24,46,0,1
1102959622191751168,2019-03-05 15:50:40,RT @cajardineMP: First reading of my gender-based pricing (prohibition) bill done ✅ let’s get rid of the outdated and sexist #pinktax once…,46,0,0,0
1102937067737239553,2019-03-05 14:21:03,"""It's such incompetence by the Government. Businesses don't have certainty, the public don't have certainty, we don… https://t.co/0Uy8LmLLqL",52,111,0,1
1102926989617451009,2019-03-05 13:41:00,"""All the mosques were very different. But in each one, we received warm hospitality and met people who were keen to… https://t.co/WOBfFsOU1D",19,62,0,1
1102909819873382400,2019-03-05 12:32:46,It is unacceptable that women and girls have to pay more for basic products like razors and deodorants compared wit… https://t.co/D1cxus9yzr,92,171,0,1
1102873615517839360,2019-03-05 10:08:54,It is fundamentally unfair that women and girls are still paying more than men for basic products such as razors an… https://t.co/vbIvas7wIb,31,67,0,1
1102623242131591168,2019-03-04 17:34:01,"What a ridiculous farce. Theresa May is scrambling for support because she knows her deal is a mess.

If you agree… https://t.co/pDENYKPEiI",62,107,0,1
1102613702786908161,2019-03-04 16:56:06,"""It is unthinkable that we can achieve that if we do not give every young person the chance to have open, informed… https://t.co/zfNNPbh9DV",12,48,0,1
1102613701625085953,2019-03-04 16:56:06,"""As a former teacher, I believe the duty of the education system is to inform and empower young people, enabling th… https://t.co/gxdmafRIiX",58,125,0,1
1102585170165669888,2019-03-04 15:02:44,"RT @RichardNewby3: Failing Grayling, the man who chaired TM leadership campaign is a shameless embarrassment who should resign or be sacked…",65,0,0,0
1102570734986117122,2019-03-04 14:05:22,"There can be no doubt that unnecessary Tory cuts have made our communities less safe.
 
The Liberal Democrats deman… https://t.co/vQDxF7bIrR",61,112,0,1
1102570641897734145,2019-03-04 14:05:00,"We cannot let Theresa May off the hook. This botched Brexit has embarrassed the country.

Make your voice heard and… https://t.co/34L2GBg0I6",36,67,0,1
1102535195385835520,2019-03-04 11:44:09,Liberal Democrats have led the fight against Brexit for over two and half years. Across the country people are dema… https://t.co/jslj0AVn9S,27,66,0,1
1102531735819038721,2019-03-04 11:30:24,RT @thomasbrake: The #LoveApprenticeship campaign by @AanLondon this #NAW2019 aims to help engage businesses with apprenticeships. Not only…,10,0,0,0
1102531692093497344,2019-03-04 11:30:14,"RT @Wera_Hobhouse: It's National Apprenticeship Week. Here in Bath, @BathCollege offer a wide range of excellent opportunities. Check them…",6,0,0,0
1102506357809442816,2019-03-04 09:49:33,Simply political bribery. This funding pales in comparison to the detrimental impact leaving the EU would have on l… https://t.co/WRVhSrLX8w,218,346,0,1
1102503646170894336,2019-03-04 09:38:47,"RT @thomasbrake: So the 'Communities Fund' (not a bribe of course) will give relatively small sums, spread over 7 years, to an unknown numb…",724,0,0,0
1102497389817020416,2019-03-04 09:13:55,"RT @EdwardJDavey: Welcome new evidence British people are becoming more positive about immigration.

Why? My view is the Brexit debacle has…",439,0,0,0
1102291300596899840,2019-03-03 19:35:00,"Demand better than Brexit with us on 23 March.

https://t.co/McmPbIJtq9",132,255,0,1
1102261856381489154,2019-03-03 17:38:00,"""There is absolutely no reason why men and women should pay different prices for exactly the same products or servi… https://t.co/NGhzgfzxPy",34,74,0,1
1102240869699276800,2019-03-03 16:14:36,Liberal Democrats have campaigned for this change for years. The next step is to ensure girls in schools have acces… https://t.co/DNVp3Xj1zq,70,150,0,1
1102233966340464640,2019-03-03 15:47:10,"RT @LaylaMoran: Fantastic news and long overdue! @LibDems had this in our last manifesto. Glad the Govt is moving towards it.

Now we need…",90,0,0,0
1102159934752317442,2019-03-03 10:53:00,"This week we passed 250,000 supporters for our campaign to Exit from Brexit. 

We're not giving up - and neither sh… https://t.co/JMkLF808LT",174,283,0,1
1101853163739668480,2019-03-02 14:34:00,"Missed @LaylaMoran on Question Time?
After another chaotic week in politics, catch up with Layla here. https://t.co/90UKHY2E0C",108,223,1,0
1101832532302200832,2019-03-02 13:12:01,"RT @joswinson: Out with a fab team chatting to people on the doorsteps about Brexit, getting ready for the People's Voice public meeting -…",25,0,0,0
1101777917816815616,2019-03-02 09:35:00,"You don't have to put up with this embarrassing Brexit. You can demand better.

Join our march against Brexit.

https://t.co/McmPbJ14OJ",234,419,0,1
1101535069800464385,2019-03-01 17:30:00,Why are we investing in unnecessary road expansion? @LaylaMoran calls for more investment into rail and cycle route… https://t.co/wfSgrhtmND,85,267,0,1
1101499917850292224,2019-03-01 15:10:19,"RT @RichardNewby3: Over 650,000 extra social care workers  needed by 2035. Net migration of EU residents to the UK has dropped to lowest le…",45,0,0,0
1101484863004295168,2019-03-01 14:10:30,RT @DoddsJane: So glad to be able to visit the St David’s Day gallery in the Senedd today. Such inspiring photos and great to see what make…,13,0,0,0
1101476489546076160,2019-03-01 13:37:14,"We blocked the Tories’ hostile environment ‘right to rent’ checks in Coalition, and now they’ve been ruled discrimi… https://t.co/1wy3lhiX2L",64,102,0,1
1101459215149867009,2019-03-01 12:28:35,Catch up on @LaylaMoran's highlights from BBC Question Time last night &gt; https://t.co/jrx1fQUP1B,174,415,1,0
1101449167887577090,2019-03-01 11:48:40,"RT @WelshLibDems: Happy Saint David’s Day from everyone here at Welsh Liberal Democrats!

Dydd Gŵyl Dewi Hapus gan Ddemocratiaid Rhyddfrydo…",30,0,0,0
1101449116029255681,2019-03-01 11:48:27,"RT @cajardineMP: Anti-Semitism, racism and intolerence has no place in 
politics. I will always stand up for people against anti-Semitism a…",9,0,0,0
1101444472423043073,2019-03-01 11:30:00,The knife crime epidemic must be stopped. But the solution is not new knife ASBOs as suggested by the Conservatives… https://t.co/vpweDLanmQ,30,64,0,1
1101433900348391424,2019-03-01 10:48:00,"""The time for change is now. Northern Ireland cannot be left behind as the only part of the UK, the only part of th… https://t.co/JJzSU7acMS",29,49,0,1
1101422503463960576,2019-03-01 10:02:42,@HaukeGruen Welcome on board Hauke!,0,1,0,0
1101421542829944834,2019-03-01 09:58:53,"Theresa May’s hostile environment and her obsession with an arbitrary, unachievable net migration target have cause… https://t.co/FeCDFfMoOD",122,196,0,1
1101266046219141125,2019-02-28 23:41:00,".@laylamoran: ""This is not right, we need a complete change in how we run our economy, that rewards companies who i… https://t.co/iHvRADVUBr",58,161,0,1
1101264045615837185,2019-02-28 23:33:03,"“It was the first time in nearly 2.5 years that we had a debate on climate change on the floor of the House, which… https://t.co/Ski1EOvNRr",64,141,0,1
1101257231989907457,2019-02-28 23:05:59,.@LaylaMoran on #BBCQT speaking about Brexit: “Aren’t we just fed up? Don’t we just want to make this stop? It is a… https://t.co/TYnxJ6ci3x,43,148,0,1
1101256762043305984,2019-02-28 23:04:07,"RT @bbcquestiontime: ‘No deal would be utterly catastrophic for this country’
Liberal Democrat MP @LaylaMoran says she supports another ref…",621,0,0,0
1101256149943443456,2019-02-28 23:01:41,".@laylamoran: ""No deal would be absolutely catastrophic for this country. The Liberal Democrats have been consisten… https://t.co/p5VE0h1jIU",128,338,0,1
1101200865442983936,2019-02-28 19:22:00,After another week of Brexit chaos make sure you catch @LaylaMoran on BBC Question Time tonight - 10:45pm on BBC One,54,132,0,0
1101184256250863616,2019-02-28 18:16:00,We need to decarbonise capitalism and take power away from figures like Vladimir Putin by developing renewable ener… https://t.co/W4RWwt2rQF,86,235,0,1
1101176211546361856,2019-02-28 17:44:02,Two weeks ago students across the country sent a clear message: climate change is real and the Government is not do… https://t.co/UVRpoaVc84,116,261,0,1
1101164375212216322,2019-02-28 16:57:00,"The Conservatives are denying people seeking asylum the dignity of working.

It’s just not on. Everyone deserves th… https://t.co/R23yyRGqLk",17,28,0,1
1101154378122215425,2019-02-28 16:17:16,"RT @LaylaMoran: Just now I spoke in my debate on climate change! 

My message is clear - young people, I and the @LibDems stand with you. W…",237,0,0,0
1101149275923365888,2019-02-28 15:57:00,This week is National Eating Disorders Awareness Week. Access to treatment is still subpar and underfunded. We dema… https://t.co/KGTXKvd8eq,8,23,0,1
1101137464926916614,2019-02-28 15:10:04,RT @LaylaMoran: Pre-match picture #climatechange #climatestrike https://t.co/VOIPJzID9I,102,0,0,1
1101120388615077890,2019-02-28 14:02:13,Be sure to catch @LaylaMoran on BBC Question Time tonight - 10:45pm on BBC One,64,125,0,0
1101083089709744128,2019-02-28 11:34:00,"You don't have to put up with this Brexit mess. You can demand better.

Join our march against Brexit &gt; 

https://t.co/McmPbJ14OJ",100,193,0,1
1101068030115807232,2019-02-28 10:34:09,"RT @CentralLobby: ""Eating disorders are life threatening illnesses, but by focusing on early intervention, the numbers of those suffering w…",20,0,0,0
1101057486189137920,2019-02-28 09:52:16,The Vagrancy Act should be a source of national shame. Under this cruel law homeless people are criminalised simply… https://t.co/KwlLvhCROM,45,73,0,1
1100851075924545536,2019-02-27 20:12:03,"RT @thomasbrake: Now Labour's #Brexit policy has been soundly defeated, look forward to working with @jeremycorbyn on securing a #PeoplesVo…",242,0,0,0
1100844439935827968,2019-02-27 19:45:41,"Liberal Democrats also reject the choice of May's bad deal and no deal. 
Our plan is very simple: give the people t… https://t.co/fCkWug2nnJ",34,65,0,1
1100842588016398336,2019-02-27 19:38:20,"With Labour's Brexit amendment defeated Jeremy Corbyn must now commit himself to a People's Vote.
For two and a hal… https://t.co/DDzJmUD6eE",81,165,0,1
1100835675484622849,2019-02-27 19:10:52,"Despite the British public deserving answers on Brexit, this week Theresa May once again kicked the can down the ro… https://t.co/GYPw4lmk6L",29,78,0,1
1100810850103975936,2019-02-27 17:32:13,"RT @vincecable: Catch up on my views on Corbyn and May’s latest Brexit shifts, the emergence of TIG, and news beyond the UK, with my blog.…",63,0,0,0
1100810767790678016,2019-02-27 17:31:53,"RT @thomasbrake: Excellent News: the @LibDem #ExitfromBrexit petition has reached our goal of 250,000 signatures! Now time to fight for a #…",77,0,0,0
1100802320005324800,2019-02-27 16:58:19,"A quick thank you message from @LaylaMoran to everyone who has helped our Exit from Brexit campaign pass 250,000 su… https://t.co/8nKjddqHOt",133,350,0,1
1100793852812804096,2019-02-27 16:24:40,"""The only thing Theresa May has in mind is the interest of the Tory Party."" @Wera_Hobhouse
Enough of this Brexit me… https://t.co/pWefgJg4mn",122,241,0,1
1100768013274570753,2019-02-27 14:42:00,"The Conservatives are denying people seeking asylum the dignity of working, leaving genuine people facing poverty,… https://t.co/4QvYYq3r9r",27,49,0,1
1100750100408745984,2019-02-27 13:30:49,Today at #PMQs @LaylaMoran asks why homeless people are still being dragged before the courts - simply because they… https://t.co/XVFKuRGlHZ,83,151,0,1
1100743535748362240,2019-02-27 13:04:44,"Fantastic news - our campaign to Exit from Brexit is 250,000 strong!

Lib Dems have led the fight against Brexit fo… https://t.co/vbYcaoRTJF",77,137,0,1
1100719695018127361,2019-02-27 11:30:00,Why is the Government preventing skilled asylum seekers find employment  and start contributing to society? It just… https://t.co/7YR7dQ6mOX,50,80,0,1
1100717771917324288,2019-02-27 11:22:21,The mess Theresa May is making out of Brexit is beyond belief. There is still time to stop Brexit. Will you join th… https://t.co/UFY7PumdgO,84,141,0,1
1100702300090388480,2019-02-27 10:20:53,"Lib Dem Peer @brianpaddick on how we can reduce knife crime.
We need to adopt a public health approach to this prob… https://t.co/WN6yQZYdz3",48,100,0,1
1100469337004040193,2019-02-26 18:55:10,"🎉We've passed 250,000 people supporting our campaign to Exit from Brexit! 🎉
The Liberal Democrats have led the figh… https://t.co/YoCwdVuA3b",140,272,0,1
1100440606709555202,2019-02-26 17:01:00,"Yesterday, @amcarmichaelMP presented his bill to end plastic pollution. Our seas are under threat: every year a hor… https://t.co/KPbnlaOYQX",57,102,0,1
1100438082921340928,2019-02-26 16:50:58,"We support the Organ Donation Bill passing the final stage in Parliament today. For a patient in need, organ donati… https://t.co/gOOES4hCT5",26,51,0,1
1100407071877431296,2019-02-26 14:47:45,Today @cajardineMP was one of the 28 women representing the number of women who travel from NI every week for an ab… https://t.co/nvV2hCgbOv,39,69,0,1
1100393286722879488,2019-02-26 13:52:58,"Whether it is in March or June, Brexit will still leave our country poorer. The only option is a People’s Vote with… https://t.co/hKGLZJI2ef",63,130,0,1
1100380594335371266,2019-02-26 13:02:32,"Theresa May has absolutely lost control of Brexit. Her last minute scramble is embarrassing for the country.
End th… https://t.co/CjbmSQ9Crf",102,186,0,1
1100377619399360512,2019-02-26 12:50:43,Theresa May knows her deal is doomed. The Conservatives have made an absolute mess of Brexit and it is time to put… https://t.co/1Jkq6ljK3E,76,144,0,1
1100360730434514944,2019-02-26 11:43:36,"It is time to once again turn your anger into positive action.

Will you join us on Saturday 23rd March to march th… https://t.co/oJgPd6x6qP",127,207,0,1
1100329395397554177,2019-02-26 09:39:05,"RT @joswinson: Hosted a brilliant discussion yesterday with experts from various organisations. We covered:

Increasing digital understandi…",29,0,0,0
1100328773931753473,2019-02-26 09:36:37,"Today the @LibDemLords will vote against Tory plans for Knife Crime Prevention Orders. @BrianPaddick explains why...
https://t.co/aC37HSPW8j",19,30,0,1
1100106416608759808,2019-02-25 18:53:03,Liberal Democrats have led the fight for a People's Vote for two and a half years. If Corbyn has truly shifted posi… https://t.co/byqIFZfarz,234,435,0,1
1100077096464977920,2019-02-25 16:56:32,It's time for real action to reduce plastic pollution in our seas. Our bill seeks to eliminate plastic pollution by… https://t.co/pmL9rDePix,52,65,0,1
1100069283596517376,2019-02-25 16:25:30,"Between 2014 and 2017 over 6,500 people were found guilty under the Vagrancy Act.
Moving homeless people on, issuin… https://t.co/oSM6Nv2Shz",69,96,0,1
1100052911093100544,2019-02-25 15:20:26,"On Eating Disorders Awareness Week we call for earlier intervention, better training for doctors &amp; standard waiting… https://t.co/cU2XNEu4D5",39,58,0,1
1100010324986597377,2019-02-25 12:31:13,"The Tories’ Knife Crime Prevention Orders are “deeply counterproductive”, say @LibertyHQ, @ChildrenSociety, @PRTuk… https://t.co/1wJrnbvcuJ",19,33,0,1
1099988635087183878,2019-02-25 11:05:02,Liberal Democrats are ready to work with The Independent Group to bring about real change. For too long the traditi… https://t.co/Peq887CmTV,286,722,0,1
1099736466035359744,2019-02-24 18:23:00,Lib Dem Leader @vincecable reacts to Theresa May’s latest Brexit vote delay. “This dangerous game of chicken has ju… https://t.co/b0xv2tbY2E,263,473,0,1
1099725439730413568,2019-02-24 17:39:11,Lib Dem Leader @vincecable on working with the Independent Group to stop Theresa May's Brexit mess and securing a P… https://t.co/XdPEDS99EH,107,222,0,1
1099720698011009025,2019-02-24 17:20:20,RT @PrestonLibDems: Action Weekend Part 2 - volunteers delivering leaflets and a teams canvassing in two different wards. Hundreds of doors…,14,0,0,0
1099683617972793344,2019-02-24 14:53:00,"Brexit is a national embarrassment - take a stand with us and demand a People's Vote.

Join our March to Stop Brexi… https://t.co/t3t3UYSHHZ",134,214,0,1
1099675157709443072,2019-02-24 14:19:23,@nermindaul Welcome on board!,0,3,0,0
1099673702080397312,2019-02-24 14:13:36,"We're almost at 250,000 signatures on our campaign to Exit from Brexit! Help us reach this milestone with a quick r… https://t.co/ccJtzZNONb",126,124,0,1
1099672033795936257,2019-02-24 14:06:58,"Another delay. Outrageous.
Theresa May's recklessness is risking Britain's future, all for the sake of keeping her… https://t.co/8Wgwds9qmC",156,249,0,1
1099636809535909888,2019-02-24 11:47:00,"Liberal Democrats have led the fight for a People's Vote for over two and half years. 
We're not giving up, and nei… https://t.co/whWWyyHBYM",49,115,0,1
1099347095629250560,2019-02-23 16:35:47,"RT @talkRADIO: Lib Dem Home Affairs spokesperson Sir Ed Davey: ""This is an unlawful decision by Sajid Javid. If you're going to deal with t…",17,0,0,0
1099333290404777984,2019-02-23 15:40:55,"While Labour leadership sits on the fence, we will once again seek to secure cross-party support for an amendment i… https://t.co/ZUWziQAiHG",220,369,0,1
1099330546549714944,2019-02-23 15:30:01,"After a turbulent week in British politics, catch up on the views of Liberal Democrat Leader @vincecable on the new… https://t.co/AD3549Nreq",64,122,0,1
1099323305281097729,2019-02-23 15:01:15,RT @SaintSwith: Perfect morning for knocking on doors in Torquay. Residents not impressed with the Conservatives being split nationally &amp; l…,16,0,0,0
1099301165941116929,2019-02-23 13:33:16,RT @NHDCLibDems: Great morning campaigning with @TonyMost2 and @stevekjarvis in Ashwell as part of the @LibDems action day #demandbetter #c…,13,0,0,0
1099298081852411904,2019-02-23 13:21:01,"Miss the Political Slot with @LaylaMoran this week? Catch up here.
It's time to stop criminalising homeless people.… https://t.co/3VYFz33vZv",46,62,0,1
1099276945831923713,2019-02-23 11:57:02,RT @yorklibdems: York team campaigning on @LibDems national action day! #Westfield @libdemlocalgov @ALDC https://t.co/S2YjuweYd6,19,0,1,0
1099235162745798656,2019-02-23 09:11:00,"Thanks to everyone out today on our National Weekend of Action.

We need to elect Lib Dem local councillors up and… https://t.co/TV8rtFv9Zv",36,105,0,1
1099234376553033728,2019-02-23 09:07:52,RT @DandWLibDems: Will be out today with lots of other local @yorklibdems Cllrs and campaigners as part of the national @LibDems Action Day…,5,0,0,0
1099234224404680704,2019-02-23 09:07:16,@owensuccs Welcome on board!,0,0,0,0
1098998353516511233,2019-02-22 17:30:00,".@JoSwinson: We share your desire to shake up the status quo, to challenge those in power who are failing our count… https://t.co/hlnVTrwrJW",51,85,0,1
1098998100910235648,2019-02-22 17:29:00,".@JoSwinson: To the new Independent Group MPs, I say: you have made a difficult, bold and important move. You are d… https://t.co/Ouy80Kcn0b",112,267,0,1
1098986266039865344,2019-02-22 16:41:58,"“Together we can advance the radical, progressive and liberal ideas our country is crying out for. Together we can… https://t.co/cc6HafYMz7",67,95,0,1
1098973968579657728,2019-02-22 15:53:06,Lib Dems are leading a people's movement against Brexit - you can get involved here &gt; https://t.co/Mp2XkNJx4v,14,34,0,1
1098973965287129091,2019-02-22 15:53:05,"Promising comments, but we need to see action next week from Labour. Liberal Democrats have led the fight for a Peo… https://t.co/ZxrAU0lj2V",34,82,0,1
1098973941828407297,2019-02-22 15:53:00,"Brexit is a national embarrassment - take a stand with us and demand a People's Vote.

Join our March to Stop Brexi… https://t.co/VIZv5fcSsZ",157,304,0,1
1098971682499375104,2019-02-22 15:44:01,".@JoSwinson at the Lib Dem Scottish conference: For the last 7 years, the Lib Dems have been proudly and positively… https://t.co/wf6YXIUzyz",15,41,0,1
1098969411963088896,2019-02-22 15:35:00,"We're almost at 250,000 people backing our campaign to give the people the final say on Brexit.

Help us get there… https://t.co/HnSyhIxK7S",132,132,0,1
1098959597749104640,2019-02-22 14:56:00,"Britain is better than this Brexit mess.
Enough is enough. It's time to stop this national embarrassment. Demand a… https://t.co/8maLbMq9zL",51,106,0,1
1098956776274345984,2019-02-22 14:44:47,"We're almost at 250,000 signatures on our campaign to Exit Brexit!

Sign up and share to help us get past 250k, and… https://t.co/AHi0fTvPQG",61,97,0,1
1098950810053066752,2019-02-22 14:21:05,RT @scotlibdems: Scottish Liberal Democrat conference has today backed a series of new measures to boost community justice. Find out more h…,5,0,0,0
1098915614192820225,2019-02-22 12:01:13,"RT @scotlibdems: Jo Swinson will address the Lib Dem conference in Hamilton today. 

This morning she warned the SNP ""Breaking a union of 4…",41,0,0,0
1098878186211999744,2019-02-22 09:32:30,"Theresa May's scare tactics of No Deal are not working.
The British people will not be bullied into this botched Br… https://t.co/CUPAfcCSJx",119,260,0,1
1098642641011593217,2019-02-21 17:56:32,"""We have been calling for a realignment of politics for decades.  I have welcomed the courageous move by 11 Members… https://t.co/VX6cws7BZ7",266,669,0,1
1098619645710528514,2019-02-21 16:25:09,"We're running a people powered campaign to win a People's Vote.
Britain deserves better than a botched Brexit force… https://t.co/e6KsjDJhDq",116,230,0,1
