id,created_at,text,retweet_count,favorite_count,media_count,url_count
1072179183424626688,2018-12-10 17:20:12,The awkward moment when you realise an Exit from Brexit is the right choice for the country. Join the fight &gt;… https://t.co/H6JgtiHSbJ,561,1152,0,1
1072169573384826881,2018-12-10 16:42:00,"After the #BrexitVote is delayed, what are the options? Theresa May cannot fix this broken deal and is running scar… https://t.co/TNuTXjGXtU",93,153,0,1
1072168514969067520,2018-12-10 16:37:48,"This Government cannot continue to kick the can down the road. 

It is time for a real #BrexitVote - a People's Vot… https://t.co/RTc17R83DZ",28,69,0,1
1072156589627490305,2018-12-10 15:50:25,Theresa May is trying to buy herself time by delaying the #BrexitVote but small modifications cannot fix this broke… https://t.co/2ahoiQdB4d,53,68,0,1
1072148415826534400,2018-12-10 15:17:56,"""She's got an awful lot of explaining to do"" 
@vincecable on Theresa May's delay of the #BrexitVote. The best way o… https://t.co/10TY8mheU2",208,320,0,1
1072134972658601984,2018-12-10 14:24:31,"Theresa May running scared of a #BrexitVote shows how weak her deal really is.

This won't be fixed by waiting long… https://t.co/pUdz2Vz82F",61,130,0,1
1072127580629884928,2018-12-10 13:55:09,It looks like Theresa May has delayed her #BrexitVote - but there's no point in delaying a deal that has no chance… https://t.co/qy8YE6FE0k,136,291,0,1
1072116975063597056,2018-12-10 13:13:00,"""Too often and in too many places, human rights and freedoms are not effectively recognised and observed.""… https://t.co/xeh7IemRRn",25,52,0,1
1072109322451206144,2018-12-10 12:42:35,"What a mess. Theresa May still cannot get her own party behind her Brexit deal.

There's only one way out of this m… https://t.co/f68MBf2MTp",89,121,0,1
1072102392848703488,2018-12-10 12:15:03,"""Too often and in too many places, human rights and freedoms are not effectively recognised and observed. The Liber… https://t.co/wDRmE1kTRX",16,36,0,1
1072098748937977856,2018-12-10 12:00:35,This morning the European Court of Justice ruled that the UK can unilaterally cancel Article 50. @thomasbrake expla… https://t.co/Z6nBdYIsqU,125,186,0,1
1072064490483662849,2018-12-10 09:44:27,We can get out of this mess - and the best way to do so is to give the people the final say on Theresa May's deal w… https://t.co/sdzmbAPTVz,52,96,0,1
1072062104319000576,2018-12-10 09:34:58,RT @thomasbrake: Tomorrow we’re holding a rally in Parliament Square to put pressure on the Government to give the people a #FinalSay on #B…,278,0,0,0
1071788560355741698,2018-12-09 15:28:00,"Don't get Theresa May get away with this broken Brexit deal. Help us get more MPs to vote down the deal, and help g… https://t.co/8KkRtiuwue",43,63,0,1
1071743262103228417,2018-12-09 12:28:00,Neither Theresa May or Jeremy Corbyn want you to have the final say on the Brexit deal. The Liberal Democrats do -… https://t.co/FsKVekX9aq,117,168,0,1
1071716082778484736,2018-12-09 10:40:00,Take action now to stop Brexit✊ You can help now - it only takes a moment 👇 https://t.co/yQoZ0vjNi4,99,142,0,1
1071425165974630401,2018-12-08 15:24:00,"Next week Theresa May will try and force her broken Brexit deal through Parliament. It's the result of a chaotic, b… https://t.co/8jXsNkgdiW",153,221,0,1
1071395470432497664,2018-12-08 13:26:00,This is not the best deal for Britain - and the people deserve to give the final say on whether this is what they w… https://t.co/CQkMBjE1k2,223,268,0,1
1071331549025464321,2018-12-08 09:12:00,"Help us stop this broken Brexit deal! 

Want to give the British people the final say on the deal, and the chance t… https://t.co/YQWqCfYBgc",136,183,0,1
1071117643917246466,2018-12-07 19:02:01,"Want to stop this broken Brexit deal? Want to give the British people the final say on the deal, and the chance to… https://t.co/YM12bVLsy4",78,95,0,1
1071070327835377664,2018-12-07 15:54:00,We need radical change on housing - the Government has failed to end this crisis. Liberal Democrats would build mor… https://t.co/T2Fmb0ZAoP,146,201,0,1
1071003934762917888,2018-12-07 11:30:10,"There's still time to back the preference of the many, not the few, @jeremycorbyn. Get on board with the Liberal De… https://t.co/WAGbiT7U8X",132,213,0,1
1070999688361451520,2018-12-07 11:13:18,"RT @thomasbrake: 55% of wine consumed in the UK is imported from the EU, whilst 45% of spirits exported from these shores is sent to the EU…",262,0,0,0
1070994326853832704,2018-12-07 10:52:00,Liberal Democrat London mayoral candidate @SiobhanBenita wishes the Jewish community a happy and peaceful Hanukkah https://t.co/C4qPi4BfWi,38,68,1,0
1070944247044427776,2018-12-07 07:33:00,"Want to stop this broken Brexit deal? Want to give the British people the final say on the deal, and the chance to… https://t.co/6xN9jZxQvg",112,151,0,1
1070784967343513601,2018-12-06 21:00:05,"Didn't catch @Wera_Hobhouse on Channel 4's Political Slot? Catch up here 👇
We must demand better than high levels o… https://t.co/S6hCL8tNrp",43,60,0,1
1070770603311988736,2018-12-06 20:03:00,"We cannot allow Theresa May to run this botched Brexit deal through Parliament. 

Help us get more MPs to support g… https://t.co/uOPJbrlHTN",168,250,0,1
1070725721272782848,2018-12-06 17:04:39,"Don't let Theresa May get away with this Brexit mess.

Take action now to help us defeat her broken Brexit deal and… https://t.co/4Wo18QwG1i",80,115,0,1
1070696085650317312,2018-12-06 15:06:54,Theresa May's government is in meltdown. She cannot force through this botched Brexit deal - we demand that the peo… https://t.co/E9hLdhSfrV,198,174,0,1
1070651155871621120,2018-12-06 12:08:21,RT @Wera_Hobhouse: Getting more and more frustrated as this #Brexit debate continues? Click below and lobby an undecided MPs to vote down t…,68,0,0,0
1070639682348859392,2018-12-06 11:22:46,Don't give Theresa May a free pass on this broken Brexit deal. We need to put pressure on specific MPs to vote agai… https://t.co/9u9J0mAIK2,34,75,0,1
1070629330840113153,2018-12-06 10:41:38,"Come on @jeremycorbyn - get behind a People's Vote on Brexit

Liberal Democrats have fought his chaotic Brexit sinc… https://t.co/FpAKcZibxE",217,329,0,1
1070399407210795008,2018-12-05 19:28:00,"""When the Prime Minister asks MPs to approve her deal, she’s asking us to bet the safety and security of the Britis… https://t.co/bDGHt9xhMU",131,215,0,1
1070392162074935296,2018-12-05 18:59:13,"RT @thomasbrake: The @LibDems can guarantee the public we will fight for them to have the final say, including the option to remain. 

@UKL…",276,0,0,0
1070384353941880832,2018-12-05 18:28:11,RT @SiobhanBenita: Wonderful atmosphere for Chanukah in the Square here in Trafalgar Square.  Speakers championing freedom and equality for…,17,0,0,0
1070378268241653763,2018-12-05 18:04:00,"Want to stop this broken Brexit deal? Want to give the British people the final say on the deal, and the chance to… https://t.co/XI3VDOILST",60,88,0,1
1070375290822647808,2018-12-05 17:52:10,"RT @timfarron: The PM's deal will make us poorer, weaker, and less safe. I love my country and will reject any deal that will harm my count…",286,0,0,0
1070371820791099394,2018-12-05 17:38:23,Today marks 14 years since the introduction of civil partnerships in the UK. We've come a long way in the fight for… https://t.co/KJtA6kSqEb,42,91,0,1
1070359058467733504,2018-12-05 16:47:40,"On #InternationalVolunteerDay we would like to thank you for:

All the doors you’ve knocked 🚪 
All the marches you’… https://t.co/NJfn8Ku8xV",57,144,0,1
1070351631500369920,2018-12-05 16:18:09,"Detaining vulnerable people for months on end without any idea when they'll be released is inhumane, unnecessary &amp;… https://t.co/cJ993PX7HK",25,48,0,1
1070321912394514437,2018-12-05 14:20:04,"Theresa May's government is completely dysfunctional and her Brexit plans are a mess.

If you're sick and tired of… https://t.co/OENItJmu9A",58,75,0,1
1070317809505353728,2018-12-05 14:03:45,"RT @thomasbrake: .@LibDems have long said that we can get out of this #Brexitmess if we chose to. 

As MPs begin to debate @Theresa_May's t…",55,0,0,0
1070281376975470592,2018-12-05 11:38:59,This Tory Brexit mess has been dragging on too long. The right thing to do now is to fight for a People’s Vote with… https://t.co/naF8n0XMDk,91,199,0,1
1070233563956764673,2018-12-05 08:29:00,Liberal Democrats have been fighting Brexit since the beginning - it's time Jeremy Corbyn got behind this fight and… https://t.co/bUmwbxzFIH,245,390,0,1
1070221736270946304,2018-12-05 07:42:00,"We cannot allow Theresa May to run this botched Brexit deal through Parliament. 

Help us get more MPs to support g… https://t.co/n4z8x6JKh4",125,181,0,1
1070044820780015618,2018-12-04 19:59:00,"We cannot allow Theresa May to run this botched Brexit deal through Parliament. 

Help us get more MPs to support g… https://t.co/i7lbYqoTtM",100,161,0,1
1070024687911088129,2018-12-04 18:39:00,"Theresa May's Brexit deal is not good for the country. 
Demand the final say on the deal with the option to stay in… https://t.co/0HljNi9iDz",187,238,0,1
1070000219557949440,2018-12-04 17:01:46,"Ministers being found in #ContemptOfParliament? How much worse can this Tory Brexit get?

Enough of this mess. Put… https://t.co/enYJIY4peP",151,275,0,1
1069998216064761857,2018-12-04 16:53:48,"The votes on #ContemptOfParliament show what an utter, unmitigated mess the Conservatives have got us into over Bre… https://t.co/A263ZC9ysv",475,1049,0,1
1069962528346660864,2018-12-04 14:32:00,"We cannot allow Theresa May to run this botched Brexit deal through Parliament. 

Help us get more MPs to support g… https://t.co/xDvN6DXk5l",152,149,0,1
1069938117451309056,2018-12-04 12:55:00,The controversy over the Brexit legal advice given to the Government reminds us how chaotic this whole process has… https://t.co/kKwgRDihks,177,238,0,1
1069927466192564225,2018-12-04 12:12:40,RT @Jamie4North: 5 days of debate on the #BrexitDeal start today but first a debate on @GOVUK refusal to fully publish Brexit legal advice.…,18,0,0,0
1069907154465943552,2018-12-04 10:51:58,RT @vincecable: I see Jeremy Corby will not debate #BrexitAgreement on BBC if other people i.e.. #PeoplesVote are represented. What is he a…,1218,0,0,0
1069904115868811265,2018-12-04 10:39:53,"""Parliament is finally taking back control from this chaotic government."" @thomasbrake 
The Government must fully p… https://t.co/b7n5qxzaMG",72,129,0,1
1069902885474000896,2018-12-04 10:35:00,"""So many of the challenges we face today transcend national borders.""

When fighting climate change to reining in t… https://t.co/7A6sTnLfHy",16,18,0,1
1069898429906726912,2018-12-04 10:17:18,Corbyn and May do not disagree when it comes to leaving the EU. Any debate on Brexit must include a voice arguing f… https://t.co/qRMKrkFPAX,40,73,0,1
1069881377062088705,2018-12-04 09:09:32,Victory for @LibDemLords on civil liberties last night. With Labour we defeated the Govt.on a vote on the… https://t.co/0WIu9R9527,45,81,0,1
1069677651239915520,2018-12-03 19:40:00,"""We need a more fundamental rethink. People with disabilities need everyone to come on side and help us to change t… https://t.co/px8sz8kEit",31,42,0,1
1069668088793174016,2018-12-03 19:02:00,"Liberal Democrat MPs voted against the unnecessary, illiberal new laws in the Government’s Counter-Terrorism Bill,… https://t.co/O9odANLfZZ",56,67,0,1
1069661041959755776,2018-12-03 18:34:00,Liberal Democrat MPs voted against the Government's Counter-Terrorism Bill and today the @LibDemLords will vote for… https://t.co/TUm8hA28YS,31,65,0,1
1069650220244361223,2018-12-03 17:51:00,"This evening @LibDemLords will try to amend the Counter-Terrorism Bill to:
- Stop the Government criminalising “rec… https://t.co/NJ01gijX4H",59,87,0,1
1069639902638161920,2018-12-03 17:10:00,The Prime Minister is asking MPs to vote on her Brexit deal without clarity on her immigration plans. What is she h… https://t.co/Okqx9haMnx,135,215,0,1
1069600392474898433,2018-12-03 14:33:00,On International Day of Persons with Disabilities Liberal Democrat President @SalBrinton explores some of the probl… https://t.co/mGRHfgcpO0,38,60,0,1
1069599902878130176,2018-12-03 14:31:03,"RT @LibDemLords: Our very own Baroness Thomas of Winchester has this to say on International Day of Persons with Disabilities!
#IDPD2018 ht…",12,0,0,0
1069580762637193218,2018-12-03 13:15:00,"Legal quagmires, cabinet departures, and economic crisis. Theresa May's Brexit deal is a mess and Britain deserves… https://t.co/VVLQUyTAen",117,169,0,1
1069574465233854464,2018-12-03 12:49:58,On International Day of Persons with Disabilities we are reminded of the fight to secure equality for people with a… https://t.co/PHD4VoYrX0,67,98,0,1
1069573269420953600,2018-12-03 12:45:13,RT @Jamie4North: People with disabilities are among the most discriminated against. It's common sense that all programmes should reach ever…,12,0,0,0
1069551495757086722,2018-12-03 11:18:42,"""In these cases, the Home Office seems to be waiting around for people to contact them - even though they may not h… https://t.co/yiQwjzK2XB",32,31,0,1
1069547292384911360,2018-12-03 11:02:00,"On International Day of Persons with Disabilities @DavidBuxtonLD shares a message using BSL.
Lib Dems are committed… https://t.co/0KgCQlKDgb",31,26,0,1
1069532614988627968,2018-12-03 10:03:41,Theresa May's immigration plans in her Brexit deal are outrageously vague. She's trying to force through a deal wit… https://t.co/AAAkwMGuu3,70,96,0,1
1069531212056809473,2018-12-03 09:58:06,RT @vincecable: Beginning big week arguing for #PeoplesVote on @BBCBreakfast @SkyNews and @itvnews .Government like a car with bits of body…,264,0,0,0
1069520955536482304,2018-12-03 09:17:21,RT @thomasbrake: Refusing to publish legal advice on #Brexit not only makes a mockery of the discredited mantra 'Take Back Control' but is…,461,0,0,0
1069520921252241408,2018-12-03 09:17:13,"RT @EdwardJDavey: Brexit &amp; immigration: shocking &amp; unacceptable for Home Secretary, Sajid Javid, to admit @BBCr4today the Immigration White…",550,0,0,0
1069228744529903621,2018-12-02 13:56:12,On International Day for the Abolition of Slavery we remember that slavery is not a thing of the past: over 40m peo… https://t.co/eRBFCObwpE,53,77,0,1
1069222653318225923,2018-12-02 13:32:00,"A Corbyn/May TV debate is an utter waste of time when they both essentially agree on Brexit.

Liberal Democrats are… https://t.co/0qeuLGMUp6",211,386,0,1
1069185516325744642,2018-12-02 11:04:26,"Barry Gardiner making false promises of a Labour negotiated Brexit on #Marr.

Liberal Democrats have been the real… https://t.co/EBuW9szOXE",109,181,0,1
1069147658864943104,2018-12-02 08:34:00,"The media must give balance. Corbyn vs May is not a true debate on Brexit.

Liberal Democrats are the real Brexit o… https://t.co/2dGfjhw3N8",259,402,0,1
1068920411436380160,2018-12-01 17:31:00,"A Brexit debate between Jeremy Corbyn and May is farcical, given that they both want Brexit to happen.

Liberal Dem… https://t.co/X2xfjjms1v",193,342,0,1
1068906067260788737,2018-12-01 16:34:00,"Corbyn vs May is not a true debate on Brexit. The media must give both sides of this issue a balanced hearing.

Lib… https://t.co/tGMx6ELOFg",97,170,0,1
1068868570501795841,2018-12-01 14:05:00,"⚡️ Check out @LaylaMoran's great appearance on #BBCQT on Thursday.

https://t.co/ZIz5qLFsuU",32,48,0,1
1068855483975565313,2018-12-01 13:13:00,"Our message is clear: let the people, not the politicians, have the final say on this Brexit deal. If it isn't good… https://t.co/JfEsmS7AO2",589,737,0,1
1068829814482595840,2018-12-01 11:31:00,"A debate between Jeremy Corbyn and Theresa May on Brexit is no real debate at all. Both support Brexit.

Liberal De… https://t.co/UhaHweZx13",89,154,0,1
1068827700784189443,2018-12-01 11:22:36,"The Home Office’s inflexibility causes untold human misery.

The Lib Dems would take responsibility for immigration… https://t.co/964QDeapxn",33,51,0,1
1068821006351921152,2018-12-01 10:56:00,"Vince Cable shares his message on World AIDS Day. 
Today we remember all those who have lost their lives to AIDS an… https://t.co/UUr3t8vNAc",63,104,0,1
1068618170481692672,2018-11-30 21:30:00,"A debate between Jeremy Corbyn and Theresa May on Brexit is no real debate at all. Both support Brexit.

Help us lo… https://t.co/GnleLjHpQ3",211,370,0,1
1068591490467856384,2018-11-30 19:43:59,"⚡️ Check out @LaylaMoran's great appearance on #BBCQT last night.

https://t.co/ZIz5qLFsuU",54,108,0,1
1068556514909143040,2018-11-30 17:25:00,"Last night on Question Time @LaylaMoran tore into plans for a Corbyn vs May TV debate on Brexit.
Liberal Democrats… https://t.co/3JalO6PWZS",171,330,0,1
1068526063293087747,2018-11-30 15:24:00,"A Corbyn-May debate? ""It's going to be a bit of a waste...""
Didn't catch @LaylaMoran on #BBCQT last night? Check ou… https://t.co/lKz9umCBeD",65,106,0,1
1068512589771038721,2018-11-30 14:30:28,RT @normanlamb: On #CarersRightsDay I want to recognise the incredible and selfless work of all unpaid carers in Norfolk and the 7 million…,89,0,0,0
1068512569269223425,2018-11-30 14:30:23,"RT @normanlamb: Carers, both paid and unpaid, are the enduring backbone of our communities. Let's honour them for #CarersRightsDay. Thank y…",66,0,0,0
1068505654124576768,2018-11-30 14:02:54,"""Vote down this deal, rule out No Deal and demand a People’s Vote"" @thomasbrake 

Britain deserves better than this… https://t.co/iPPgFXtZ6F",76,116,0,1
1068497770959552513,2018-11-30 13:31:34,A debate on Brexit requires balance - which means we should have the true Brexit-opposition represented. That isn't… https://t.co/tbEWxczZWX,430,628,0,1
1068480594626121729,2018-11-30 12:23:19,The Conservatives have shown time and again that they cannot be trusted with immigration policy. Liberal Democrats… https://t.co/DJixJj3Xwc,27,41,0,1
1068455000064561154,2018-11-30 10:41:37,"Theresa May's scare tactics won't work.

Now we have the terms of the exit deal we should give the people, not the… https://t.co/shFamEYwo5",68,123,0,1
1068426028824125440,2018-11-30 08:46:30,"RT @britainelects: Stratford North (Warwickshire) result:

LDEM: 40.7% (+12.2)
CON: 28.3% (+4.1)
SFI: 16.0% (-17.1)
LAB: 8.3% (-0.9)
GRN: 6…",328,0,0,0
1068426010276913152,2018-11-30 08:46:25,"RT @britainelects: Wheatley (Oxfordshire) result:

LDEM: 61.0% (+15.8)
CON: 31.2% (-11.8)
LAB: 7.9% (-4.0)

Liberal Democrat HOLD.",214,0,0,0
1068425992430133248,2018-11-30 08:46:21,"RT @britainelects: Aylesbury North West (Buckinghamshire) result:

LDEM: 39.3% (+9.5)
CON: 30.5% (+5.9)
LAB: 25.6% (+2.9)
GRN: 4.6% (+1.4)…",212,0,0,0
1068292118035206144,2018-11-29 23:54:23,"""Driving our children to be seen as a number in the way they have been is making our education system so much worse… https://t.co/UoABM2YCtu",35,70,0,1
1068289365514903557,2018-11-29 23:43:27,"""What you have here is two people who are advocating for Brexit."" @LaylaMoran on a potential Corbyn-May debate… https://t.co/BZk1SQbb8E",85,158,0,1
1068287627416211457,2018-11-29 23:36:32,"""We're not saying we want to be part of the single market, we want a single market deal."" @RLong_Bailey but no deta… https://t.co/gL0bp1FcgC",24,57,0,1
1068286862278705152,2018-11-29 23:33:30,"It's simple. ""The promises that were made cannot be kept."" Theresa May has completely botched this whole process -… https://t.co/8UxsqsGeGo",139,307,0,1
1068285074351759363,2018-11-29 23:26:24,"""There was another way she could have approached this. Theresa May has botched the strategy."" @LaylaMoran on #BBCQT… https://t.co/6k0yLMm7as",47,110,0,1
1068284804188307457,2018-11-29 23:25:19,Conservative MP Nadhim Zahawi isn't fooling anyone with his vision of Brexit. Even the Government admit this deal l… https://t.co/SEZuB4LZEq,12,28,0,1
1068284315249909761,2018-11-29 23:23:23,RT @Ali_Malik: @bbcquestiontime Obviously messiahs like @Jacob_Rees_Mogg would dub economists as charlatans. It’s the common person who wou…,2,0,0,0
1068283593863110656,2018-11-29 23:20:31,“if there is deadlock in Parliament that is when we have to throw it back to the people” @LaylaMoran. This is the w… https://t.co/CIPeR9Pxvx,23,58,0,1
1068283354318032896,2018-11-29 23:19:34,"“She has decided to side with the DUP, the hard liners in her party and alienate everyone else including remainer T… https://t.co/6J74yt5GfV",15,52,0,1
1068282141597929473,2018-11-29 23:14:44,"""There is a way out. The way out is to put it back to the people. Democracy means people are allowed to change thei… https://t.co/niAuNlhUDi",508,1101,0,1
1068281478440804352,2018-11-29 23:12:06,Labour sadly still refuse to commit to a People's Vote on the Brexit deal. Only he Liberal Democrats have fought to… https://t.co/CuEuAlZ6dT,56,81,0,1
1068280589634158592,2018-11-29 23:08:34,"""If you are not at the table you are likely to be on the menu” @LaylaMoran on the Brexit deal. Let's put an end to… https://t.co/nE5ZuGEwFD",114,172,0,1
1068280380145451009,2018-11-29 23:07:44,"""This deal makes us rule takers, not rule makers. Liberal Democrats for a final say so it goes to the people.""… https://t.co/Pqw9oVaT5H",81,150,0,1
1068279830267998209,2018-11-29 23:05:33,"RT @piginthepoke: Going to have to make an exception to #BBCQT boycott to watch the excellent @laylamoran 
@LibDems #FinalSay #ExitBrexit…",7,0,0,0
1068279794729656321,2018-11-29 23:05:25,RT @sheehanshas: .@LaylaMoran is right. We don’t have to do this #exitbrexit #peoplesvote,7,0,0,0
1068279749737422854,2018-11-29 23:05:14,RT @DrPWest: No-one voted to be poorer and the majority would rather #exitbrexit than face economic suicide #bbcqt,12,0,0,0
1068279668552491008,2018-11-29 23:04:55,"RT @BSmytherman: Great to see @LibDems finally represented on #bbcqt - Go @LaylaMoran let’s expose the whole #BrexitShambles 
Let’s make ca…",19,0,0,0
1068277972463960065,2018-11-29 22:58:10,"“This deal makes us rule takers not rule makers, this deal must go back to the people so they can decide if that de… https://t.co/AYxX4Y3r5E",129,257,0,1
1068277683497373697,2018-11-29 22:57:02,"""“If we want to spend more money on public services we have to have the best deal possible - which is the one we al… https://t.co/Gpjng6512J",53,95,0,1
1068270588421185536,2018-11-29 22:28:50,Make sure you tune into BBC One at 10:45 to catch Lib Dem MP @LaylaMoran on Question Time. #BBQT #ExitBrexit,15,37,0,0
1068235901472509952,2018-11-29 20:11:00,"Tonight @LaylaMoran will be appearing on BBC Question time. Tune in tonight, BBC One at 10:45pm",50,109,0,0
1068202178802663424,2018-11-29 17:57:00,Make sure you catch @LaylaMoran on BBC Question time - tonight BBC One at 10:45pm,33,72,0,0
1068172249696415744,2018-11-29 15:58:04,"RT @LDCRE1: At @LondonLibDems conference 
@LDCRE1 chair Roderick Lynch.

With speakers @vincecable &amp; @RabinaKhan. The hosts @THLDs done the…",9,0,0,0
1068169921551654913,2018-11-29 15:48:49,"The #Brexitdebate is utterly ridiculous. Two people who, for all intents and purposes, agree on Brexit cannot hold… https://t.co/mU6ibQq9SD",192,377,0,1
1068162668656177153,2018-11-29 15:20:00,"""In order to have a debate you have to have a disagreement.""
The idea of May/Corbyn Brexit debate is ridiculous - b… https://t.co/SYP38q17kl",180,290,0,1
1068152592398716928,2018-11-29 14:39:58,RT @vincecable: The public demand the full facts and figures on the cost of Brexit. They also deserve to hear all the options. A People's V…,819,0,0,0
1068113579382095872,2018-11-29 12:04:56,"A May/Corbyn debate would be a travesty.
Both support Brexit - we must have a voice arguing for a People's Vote on… https://t.co/tmV3J5uW4n",520,686,0,1
1068092455902478337,2018-11-29 10:41:00,On International Women Human Rights Defender Day Jo Swinson shares her message in support of the Write for Rights c… https://t.co/lhpxNqEEnh,55,67,0,1
1067869738447978496,2018-11-28 19:56:00,"Make sure you catch @LaylaMoran on BBC Question time - tomorrow evening, BBC One at 10:45pm",37,54,0,0
1067857658667909120,2018-11-28 19:08:00,Here @edwardjdavey explains why the Liberal Democrats are opposing mandatory sentences on the Offensive Weapons Bil… https://t.co/0zxNcuFQnk,26,46,0,1
1067836221227962375,2018-11-28 17:42:49,"May's deal is a mess. Even her own government admit it will leave the country worse off.

The people must have the… https://t.co/S9UPatQt1L",163,258,0,1
1067832514432196608,2018-11-28 17:28:05,"RT @thomasbrake: Sad to see @theresa_may ducking @vincecable ‘s challenge yesterday. 

What is the point of having a debate of two people o…",154,0,0,0
1067804328445075456,2018-11-28 15:36:05,"This afternoon, Lib Dem MPs will oppose Government plans to create new mandatory short-term prison sentences.… https://t.co/BUxqpFmDTt",15,31,0,1
1067766494560468992,2018-11-28 13:05:45,"This is not a choice between no deal and Theresa May's botched deal. 
The people must be given the choice between t… https://t.co/YrS2Knyff4",143,212,0,1
1067764553486872576,2018-11-28 12:58:02,"RT @thomasbrake: .@theresa_may is playing with people's lives by refusing to rule out No Deal in answer to @vincecable at #pmqs

People are…",128,0,0,0
1067747943090810881,2018-11-28 11:52:02,"Even the Chancellor accepts the fact: all forms of Brexit will leave us worse off. 

We must put an end to this emb… https://t.co/akJNUkCIqa",135,172,0,1
1067747163155910656,2018-11-28 11:48:56,RT @thomasbrake: For the second time in a week the Chancellor has openly admitted that the UK will suffer economically because of @theresa_…,243,0,0,0
1067730464583139328,2018-11-28 10:42:34,"RT @thomasbrake: Have the newly-fanged advocates of a Norway+ deal checked with Norway what they think of Norway's deal?

If they have, the…",226,0,0,0
