,Text,Classification
194, Wewill continue to work closely with our European allies in foreign and defence policy evenas we leave the EU itself,Republican
195,12,Non-Aligned
196," A smooth, orderly BrexitThese are our objectives for the negotiation ahead - objectives that will help to realiseour ambition of shaping that stronger, fairer, Global Britain that we want to see",Republican
197,"They are the basis for a new, strong, constructive partnership with the European Union -a partnership of friends and allies, of interests and values",Non-Aligned
198, A partnership for a strong EUand a strong UK,Non-Aligned
199,But there is one further objective we are setting,Non-Aligned
200," For as I have said before - it is in noone's interests for there to be a cliff-edge for business or a threat to stability, as wechange from our existing relationship to a new partnership with the EU",Non-Aligned
201,"By this, I do not mean that we will seek some form of unlimited transitional status, inwhich we find ourselves stuck forever in some kind of permanent political purgatory",Democratic
202,"That would not be good for Britain, but nor do I believe it would be good for the EU",Non-Aligned
203,"Instead, I want us to have reached an agreement about our future partnership by thetime the two-year Article Fifty process has concluded",Non-Aligned
204,"From that point onwards, we believe a phased process of implementation, in which bothBritain and the EU institutions and member states prepare for the new arrangementsthat will exist between us will be in our mutual self-interest",Democratic
205, This will give businessesenough time to plan and prepare for those new arrangements,Democratic
206,"This might be about our immigration controls, customs systems or the way in which wecooperate on criminal justice matters",Democratic
207, Or it might be about the future legal andregulatory framework for financial services,Democratic
208," For each issue, the time we need to phaseinthe new arrangements may differ",Non-Aligned
209," Some might be introduced very quickly, somemight take longer",Non-Aligned
210, And the interim arrangements we rely upon are likely to be a matterof negotiation,Democratic
211,"But the purpose is clear: we will seek to avoid a disruptive cliff-edge, and we will doeverything we can to phase in the new arrangements we require as Britain and the EUmove towards our new partnership",Democratic
212,"So, these are the objectives we have set",Non-Aligned
213, Certainty wherever possible,Non-Aligned
214, Control of ourown laws,Non-Aligned
215, Strengthening the United Kingdom,Non-Aligned
216, Maintaining the Common Travel Areawith Ireland,Non-Aligned
217,Control of immigration,Republican
218," Rights for EU nationals in Britain, and British nationals in the EU",Non-Aligned
219,Enhancing rights for workers,Democratic
220, Free trade with European markets,Non-Aligned
221, New tradeagreements with other countries,Democratic
222, A leading role in science and innovation,Non-Aligned
223," Cooperationon crime, terrorism and foreign affairs",Republican
224," And a phased approach, delivering a smooth andorderly Brexit",Non-Aligned
225,This is the framework of a deal that will herald a new partnership between the UK andthe EU,Non-Aligned
226,"It is a comprehensive and carefully considered plan that focuses on the ends, not justthe means - with its eyes fixed firmly on the future, and on the kind of country we will beonce we leave",Democratic
227,It reflects the hard work of many in this room today who have worked tirelessly to bringit together and to prepare this country for the negotiation ahead,Democratic
228,"And it will, I know, be debated and discussed at length",Democratic
229, That is only right,Non-Aligned
230," But those whourge us to reveal more - such as the blow-by-blow details of our negotiating strategy,the areas in which we might compromise, the places where we think there are potentialtrade-offs - will not be acting in the national interest",Republican
231,Because this is not a game or a time for opposition for opposition's sake,Non-Aligned
232, It is a crucialand sensitive negotiation that will define the interests and the success of our country formany years to come,Republican
233, And it is vital that we maintain our discipline,Non-Aligned
234,That is why I have said before - and will continue to say - that every stray word andevery hyped up media report is going to make it harder for us to get the right deal forBritain,Democratic
235,"Our opposite numbers in the European Commission know it, which is why they arekeeping their discipline",Non-Aligned
236," And the ministers in this Government know it too, which is whywe will also maintain ours",Non-Aligned
237,"So however frustrating some people find it, the Government will not be pressured intosaying more than I believe it is in our national interest to say",Democratic
238," Because it is not my job tofill column inches with daily updates, but to get the right deal for Britain",Republican
239, And that is whatI intend to do,Non-Aligned
240,I am confident that a deal - and a new strategic partnership between the UK and the EU- can be achieved,Non-Aligned
241,"This is firstly because, having held conversations with almost every leader from everysingle EU member state; having spent time talking to the senior figures from theEuropean institutions, including President Tusk, President Juncker, and PresidentSchulz; and after my Cabinet colleagues David Davis, Philip Hammond and BorisJohnson have done the same with their interlocutors, I am confident that the vastmajority want a positive relationship between the UK and the EU after Brexit",Democratic
242,And I am confident that the objectives I am setting out today are consistent with theneeds of the EU and its Member States,Republican
243,"That is why our objectives include a proposed Free Trade Agreement between Britainand the European Union, and explicitly rule out membership of the EU's Single Market",Republican
244," Because when the EU's leaders say they believe the four freedoms of the Single Marketare indivisible, we respect that position",Democratic
245," When the 27 Member States say they want tocontinue their journey inside the European Union, we not only respect that fact butsupport it",Democratic
246,"Because we do not want to undermine the Single Market, and we do not want toundermine the European Union",Democratic
247, We want the EU to be a success and we want itsremaining member states to prosper,Republican
248, And of course we want the same for Britain,Non-Aligned
249,And the second reason I believe it is possible to reach a good deal is that the kind ofagreement I have described today is the economically rational thing that both Britainand the EU should aim for,Democratic
250, Because trade is not a zero sum game: more of it makes usall more prosperous,Non-Aligned
251,"Free trade between Britain and the European Union means more trade, and more trademeans more jobs and more wealth creation",Republican
252," The erection of new barriers to trade,meanwhile, means the reverse: less trade, fewer jobs, lower growth",Republican
253,The third and final reason I believe we can come to the right agreement is thatcooperation between Britain and the EU is needed not just when it comes to trade butwhen it comes to our security too,Republican
254,Britain and France are Europe's only two nuclear powers,Democratic
255, We are the only twoEuropean countries with permanent seats on the United Nations Security Council,Republican
256,Britain's armed forces are a crucial part of Europe's collective defence,Non-Aligned
257,And our intelligence capabilities - unique in Europe - have already saved countless livesin very many terrorist plots that have been thwarted in countries across our continent,Republican
258,"After Brexit, Britain wants to be a good friend and neighbour in every way, and thatincludes defending the safety and security of all of our citizens",Non-Aligned
259,So I believe the framework I have outlined today is in Britain's interests,Non-Aligned
260, It is in Europe'sinterests,Non-Aligned
261, And it is in the interests of the wider world,Non-Aligned
262,But I must be clear,Democratic
263, Britain wants to remain a good friend and neighbour to Europe,Non-Aligned
264, YetI know there are some voices calling for a punitive deal that punishes Britain anddiscourages other countries from taking the same path,Democratic
265,That would be an act of calamitous self-harm for the countries of Europe,Republican
266, And it wouldnot be the act of a friend,Non-Aligned
267,Britain would not - indeed we could not - accept such an approach,Non-Aligned
268, And while I amconfident that this scenario need never arise - while I am sure a positive agreement canbe reached - I am equally clear that no deal for Britain is better than a bad deal forBritain,Democratic
269,Because we would still be able to trade with Europe,Non-Aligned
270, We would be free to strike tradedeals across the world,Democratic
271, And we would have the freedom to set the competitive tax ratesand embrace the policies that would attract the world's best companies and biggestinvestors to Britain,Republican
272,And - if we were excluded from accessing the Single Market - we would be free tochange the basis of Britain's economic model,Non-Aligned
273,"But for the EU, it would mean new barriers to trade with one of the biggest economies inthe world",Republican
274, It would jeopardise investments in Britain by EU companies worth more thanhalf a trillion pounds,Non-Aligned
275, It would mean a loss of access for European firms to the financialservices of the City of London,Non-Aligned
276,It would risk exports from the EU to Britain worth around £290 billion every year,Non-Aligned
277, And itwould disrupt the sophisticated and integrated supply chains upon which many EUcompanies rely,Democratic
278,Important sectors of the EU economy would also suffer,Democratic
279,"We are a crucial - profitable - export market for Europe's automotive industry, as well assectors including energy, food and drink, chemicals, pharmaceuticals, and agriculture",Non-Aligned
280,These sectors employ millions of people around Europe,Democratic
281,"And I do not believe that the EU's leaders will seriously tell German exporters, Frenchfarmers, Spanish fishermen, the young unemployed of the Eurozone, and millions ofothers, that they want to make them poorer, just to punish Britain and make a politicalpoint",Republican
282,For all these reasons - and because of our shared values and the spirit of goodwill thatexists on both sides - I am confident that we will follow a better path,Democratic
283, I am confident thata positive agreement can be reached,Republican
284,It is right that the Government should prepare for every eventuality - but to do so in theknowledge that a constructive and optimistic approach to the negotiations to come is inthe best interests of Europe and the best interests of Britain,Republican
285,"We do not approach these negotiations expecting failure, but anticipating success",Republican
286,"Because we are a great, global nation with so much to offer Europe and so much tooffer the world",Republican
287,One of the world's largest and strongest economies,Democratic
288," With the finest intelligenceservices, the bravest armed forces, the most effective hard and soft power, andfriendships, partnerships and alliances in every continent",Democratic
289,And another thing that's important,Non-Aligned
290, The essential ingredient of our success,Non-Aligned
291, Thestrength and support of 65 million people willing us to make it happen,Democratic
292,"Because after all the division and discord, the country is coming together",Democratic
293,The referendum was divisive at times,Non-Aligned
294, And those divisions have taken time to heal,Democratic
295,"But one of the reasons that Britain's democracy has been such a success for so manyyears is that the strength of our identity as one nation, the respect we show to oneanother as fellow citizens, and the importance we attach to our institutions means thatwhen a vote has been held we all respect the result",Democratic
296,The victors have the responsibility to act magnanimously,Republican
297, The losers have theresponsibility to respect the legitimacy of the outcome,Democratic
298, And the country comes together,Democratic
299,And that is what we are seeing today,Non-Aligned
300," Business isn't calling to reverse the result, butplanning to make a success of it",Republican
301, The House of Commons has voted overwhelmingly forus to get on with it,Democratic
302, And the overwhelming majority of people - however they voted -want us to get on with it too,Democratic
303,So that is what we will do,Non-Aligned
304,"Not merely forming a new partnership with Europe, but building a stronger, fairer, moreGlobal Britain too",Democratic
305,And let that be the legacy of our time,Democratic
306, The prize towards which we work,Non-Aligned
307, The destinationat which we arrive once the negotiation is done,Non-Aligned
308,"And let us do it not for ourselves, but for those who follow",Democratic
309, For the country's childrenand grandchildren too,Democratic
310,"So that when future generations look back at this time, they will judge us not only by thedecision that we made, but by what we made of that decision",Democratic
311,They will see that we shaped them a brighter future,Non-Aligned
312,They will know that we built them a better Britain,Non-Aligned
313,"""",Non-Aligned
